{"run":143,"commit":"30967a1","metric":176,"metrics":{"fallow_health_score":77.6,"complexity_introduced":42,"dead_code":0,"dupes":0,"tests_pass":0,"lint_pass":1,"typecheck_pass":1},"status":"keep","description":"refactor(oauth): decompose validateOauthStartRequest in mcp-oauth router","timestamp":1784014581540,"segment":3,"confidence":3,"asi":{"hypothesis":"validateOauthStartRequest had sequential validation with five early-return branches. Extracting per-concern validators and a short-circuiting step loop drops the orchestrator below the CRAP threshold and reduces complexity_introduced by 1.","next_action":"Continue targeting CRAP findings. Next candidates: chat/message-input-controller.js arrow, admin/users/overview-render.js buildAccessInspectorHeader + arrow, chat/chat-message-utils.js extractThinkingBlocks, admin/settings/policies.js render, chat/chat.js drawChats, src/routers/users/mcp-oauth.js resolveClientCredentials.","files_changed":["src/routers/users/mcp-oauth.js"]}}
{"run":144,"commit":"a56c72d","metric":175,"metrics":{"fallow_health_score":77.6,"complexity_introduced":42,"dead_code":0,"dupes":0,"tests_pass":0,"lint_pass":1,"typecheck_pass":1},"status":"keep","description":"refactor(chat): extract shouldCloseMenu helper for click handler in message-input-controller","timestamp":1784015077019,"segment":3,"confidence":2.9473684210526314,"asi":{"hypothesis":"The document click handler had two inside-outside menu checks with optional chains. Extracting shouldCloseMenu and per-menu close helpers removes the CRAP findings without adding complexity.","files_changed":["public/js/features/chat/message-input-controller.js"]}}
{"run":145,"commit":"d1e8f1b","metric":174,"metrics":{"fallow_health_score":77.6,"complexity_introduced":42,"dead_code":0,"dupes":0,"tests_pass":0,"lint_pass":1,"typecheck_pass":1},"status":"keep","description":"refactor(chat): decompose extractThinkingBlocks in chat-message-utils","timestamp":1784015358340,"segment":3,"confidence":2.9,"asi":{"hypothesis":"extractThinkingBlocks had nested while/for loops with multiple indexOf and branch checks. Extracting findTagOpen and extractTagContents removes the CRAP finding.","next_action":"Continue targeting CRAP findings. Next candidates: shared/markdown-shared.js convertDisplayMathBlocks, chat/keyboard-navigation.js handleChatRowKeydown, admin/users/overview-render.js buildAccessInspectorHeader + arrow, admin/settings/policies.js render, chat/chat.js drawChats.","files_changed":["public/js/features/chat/chat-message-utils.js"]}}
{"run":146,"commit":"58cd447","metric":173,"metrics":{"fallow_health_score":77.6,"complexity_introduced":42,"dead_code":0,"dupes":0,"tests_pass":0,"lint_pass":1,"typecheck_pass":1},"status":"keep","description":"refactor(shared): share scope-label utility between model and tool server selectors","timestamp":1784015673384,"segment":3,"confidence":3,"asi":{"hypothesis":"getToolServerScopeLabel duplicated the same personal/shared logic as getModelScopeLabel. Extracting a shared getItemScopeLabel utility in public/js/shared/utils/scope-label.js removes the CRAP finding in tool-selection and keeps dupes at 0.","next_action":"Continue targeting CRAP findings. Next candidates: shared/markdown-shared.js convertDisplayMathBlocks, chat/keyboard-navigation.js handleChatRowKeydown, admin/users/overview-render.js buildAccessInspectorHeader + arrow, admin/settings/policies.js render, chat/chat.js drawChats.","files_changed":["public/js/shared/utils/scope-label.js","public/js/features/chat/model-selector-helpers.js","public/js/features/chat/message-input-tool-selection.js"]}}
{"run":147,"commit":"56afa4b","metric":172,"metrics":{"fallow_health_score":77.6,"complexity_introduced":42,"dead_code":0,"dupes":0,"tests_pass":0,"lint_pass":1,"typecheck_pass":1},"status":"keep","description":"refactor(account): extract save result resolution in integrations modal","timestamp":1784015957313,"segment":3,"confidence":3.1,"asi":{"hypothesis":"The save button click handler resolved savedServer via chained optional/fallback and conditionally merged. Extracting resolveSavedServer and buildMergedServer removes the arrow CRAP finding.","files_changed":["public/js/features/account/account-integrations-modal.js"]}}
{"run":148,"commit":"1d8f9b9","metric":171,"metrics":{"fallow_health_score":77.6,"complexity_introduced":42,"dead_code":0,"dupes":0,"tests_pass":0,"lint_pass":1,"typecheck_pass":1},"status":"keep","description":"refactor(chat): decompose drawChats fallback list builder","timestamp":1784016266400,"segment":3,"confidence":3.2,"asi":{"hypothesis":"drawChats mixed fallback DOM construction, loading/more sentinel handling, and pinned-section toggle. Extracting buildChatButton, appendLoadingRow, appendMoreSentinel, buildFallbackChatListFragment, and buildPinnedToggle removes the CRAP finding.","files_changed":["public/js/features/chat/chat.js"]}}
{"run":149,"commit":"702fac2","metric":170,"metrics":{"fallow_health_score":77.6,"complexity_introduced":42,"dead_code":0,"dupes":0,"tests_pass":0,"lint_pass":1,"typecheck_pass":1},"status":"keep","description":"refactor(shared): decompose convertDisplayMathBlocks into line processor","timestamp":1784016581667,"segment":3,"confidence":3.3,"asi":{"hypothesis":"convertDisplayMathBlocks had nested loops/branches for fence toggling and inline/block math. Extracting handleMathLine and processDisplayMathLine reduces convertDisplayMathBlocks cyclomatic complexity below the threshold.","files_changed":["public/js/shared/markdown-shared.js"]}}
{"run":150,"commit":"7370fbb","metric":169,"metrics":{"fallow_health_score":77.6,"complexity_introduced":42,"dead_code":0,"dupes":0,"tests_pass":0,"lint_pass":1,"typecheck_pass":1},"status":"keep","description":"refactor(admin): extract saveAdminRole from onSaveRole arrow","timestamp":1784016844311,"segment":3,"confidence":3.4,"asi":{"hypothesis":"onSaveRole duplicated create/update logic in an async arrow. Extracting saveAdminRole with a ternary removes the CRAP arrow finding.","files_changed":["public/js/features/admin/users/roles.js"]}}
{"run":151,"commit":"4c1b20d","metric":168,"metrics":{"fallow_health_score":77.6,"complexity_introduced":41,"dead_code":0,"dupes":0,"tests_pass":0,"lint_pass":1,"typecheck_pass":1},"status":"keep","description":"refactor(llm): extract classifyFinishReason from normalizeFinishReason","timestamp":1784017085954,"segment":3,"confidence":3.5,"asi":{"hypothesis":"normalizeFinishReason had a chain of if-else branches for finish reason classification. Extracting classifyFinishReason reduces the exported function's cyclomatic complexity below the CRAP threshold.","files_changed":["src/llm/stream-parser-handler-helpers.js"]}}
{"run":152,"commit":"ea447d8","metric":167,"metrics":{"fallow_health_score":77.6,"complexity_introduced":41,"dead_code":0,"dupes":0,"tests_pass":0,"lint_pass":1,"typecheck_pass":1},"status":"keep","description":"refactor(chat): replace handleChatRowKeydown switch with key handler map","timestamp":1784017383774,"segment":3,"confidence":3.4285714285714284,"asi":{"hypothesis":"handleChatRowKeydown used a switch statement with seven case branches. Replacing it with a CHAT_ROW_KEY_HANDLERS map and small per-key helpers removes the high-cyclomatic finding.","files_changed":["public/js/features/chat/keyboard-navigation.js"]}}
{"run":153,"commit":"afa12cc","metric":166,"metrics":{"fallow_health_score":77.6,"complexity_introduced":41,"dead_code":0,"dupes":0,"tests_pass":0,"lint_pass":1,"typecheck_pass":1},"status":"keep","description":"refactor(llm): decompose buildAnthropicTools into predicate and item builder","timestamp":1784017645338,"segment":3,"confidence":3.3636363636363638,"asi":{"hypothesis":"buildAnthropicTools combined loop iteration, type guard, name guard, and object construction. Extracting isAnthropicFunctionTool and buildAnthropicToolItem removes the CRAP finding.","files_changed":["src/llm/provider-adapters.js"]}}
{"run":154,"commit":"f406adf","metric":165,"metrics":{"fallow_health_score":77.6,"complexity_introduced":40,"dead_code":0,"dupes":0,"tests_pass":0,"lint_pass":1,"typecheck_pass":1},"status":"keep","description":"refactor(shared): decompose renderMermaidPreview runtime checks","timestamp":1784017901945,"segment":3,"confidence":3.619047619047619,"asi":{"hypothesis":"renderMermaidPreview had a complex mermaid availability check and inline renderId construction. Extracting resolveMermaidInstance, isMermaidRenderable, and buildMermaidRenderId reduces the function's cyclomatic complexity.","files_changed":["public/js/shared/markdown-special-block-runtime.js"]}}
{"run":155,"commit":"f406adf","metric":164,"metrics":{"fallow_health_score":77.6,"complexity_introduced":39,"dead_code":0,"dupes":0,"tests_pass":0,"lint_pass":1,"typecheck_pass":1},"status":"keep","description":"refactor(account): decompose loadModels into startLoadingModels and fetchAndApplyModels","timestamp":1784018197698,"segment":3,"confidence":3.9,"asi":{"hypothesis":"loadModels combined loading-state setup, fetch/payload processing, and error handling in one async arrow. Extracting startLoadingModels and fetchAndApplyModels removes the CRAP finding and reduces complexity_introduced by 1.","files_changed":["public/js/features/account/account-models.js"]}}
{"run":156,"commit":"f406adf","metric":163,"metrics":{"fallow_health_score":77.6,"complexity_introduced":38,"dead_code":0,"dupes":0,"tests_pass":0,"lint_pass":1,"typecheck_pass":1},"status":"keep","description":"refactor(account): extract applyFieldSourceOrders from mergeSavedServer","timestamp":1784018479671,"segment":3,"confidence":3.8095238095238093,"asi":{"hypothesis":"mergeSavedServer combined object merging with a loop over FIELD_SOURCE_ORDERS. Extracting applyFieldSourceOrders removes the arrow CRAP finding and reduces complexity_introduced.","files_changed":["public/js/features/account/account-integrations.js"]}}
{"run":157,"commit":"f406adf","metric":162,"metrics":{"fallow_health_score":77.6,"complexity_introduced":37,"dead_code":0,"dupes":0,"tests_pass":0,"lint_pass":1,"typecheck_pass":1},"status":"keep","description":"refactor(server): decompose handleApiRequest into binding check and route dispatch","timestamp":1784018796887,"segment":3,"confidence":3.727272727272727,"asi":{"hypothesis":"handleApiRequest had sequential binding validations, auth handling, and route dispatch inline. Extracting checkApiBindings and dispatchApiRoutes removes the CRAP finding and reduces complexity_introduced.","files_changed":["src/index.js"]}}
{"run":158,"commit":"f406adf","metric":161,"metrics":{"fallow_health_score":77.6,"complexity_introduced":37,"dead_code":0,"dupes":0,"tests_pass":0,"lint_pass":1,"typecheck_pass":1},"status":"keep","description":"refactor(admin): decompose saveRole arrow in roles-modal","timestamp":1784019125014,"segment":3,"confidence":3.8181818181818183,"asi":{"hypothesis":"saveRole combined validation, payload building, button state toggling, and error handling. Extracting validateRoleName, buildRolePayload, setSaveButtonSaving, and setSaveButtonIdle removes the CRAP finding.","files_changed":["public/js/features/admin/users/roles-modal.js"]}}
{"run":159,"commit":"f406adf","metric":160,"metrics":{"fallow_health_score":77.6,"complexity_introduced":36,"dead_code":0,"dupes":0,"tests_pass":0,"lint_pass":1,"typecheck_pass":1},"status":"keep","description":"refactor(admin): decompose parseConnectionTestBody field resolution","timestamp":1784019399426,"segment":3,"confidence":3.909090909090909,"asi":{"hypothesis":"parseConnectionTestBody resolved multiple body fields with chained fallbacks inline. Extracting resolveProviderType, resolveProviderFamily, resolveConnectionId, and resolveBaseUrl removes the CRAP finding and reduces complexity_introduced.","files_changed":["src/routers/admin/admin-connections-list.js"]}}
{"run":160,"commit":"f406adf","metric":159,"metrics":{"fallow_health_score":77.6,"complexity_introduced":35,"dead_code":0,"dupes":0,"tests_pass":0,"lint_pass":1,"typecheck_pass":1},"status":"keep","description":"refactor(admin): decompose buildAccessInspectorHeader into chip/banner helpers","timestamp":1784019679806,"segment":3,"confidence":4,"asi":{"hypothesis":"buildAccessInspectorHeader had inline ternaries for account status chip, pending banner, and disabled toggle label. Extracting buildStatusChip, buildPendingBanner, and buildDisabledToggleLabel removes the CRAP finding and reduces complexity_introduced.","files_changed":["public/js/features/admin/users/overview-render.js"]}}
{"run":161,"commit":"f406adf","metric":158,"metrics":{"fallow_health_score":77.6,"complexity_introduced":34,"dead_code":0,"dupes":0,"tests_pass":0,"lint_pass":1,"typecheck_pass":1},"status":"keep","description":"refactor(chat): decompose handleMessageCancelled into refresh helpers","timestamp":1784019998009,"segment":3,"confidence":4.090909090909091,"asi":{"hypothesis":"handleMessageCancelled combined chat refresh, message refresh, and stream stop logic with nested if/else. Extracting refreshChatFromEvent, refreshMessageFromEvent, and stopStreamIfActive removes the CRAP finding.","files_changed":["public/js/features/chat/chat-realtime-controller.js"]}}
{"run":162,"commit":"f406adf","metric":157,"metrics":{"fallow_health_score":77.6,"complexity_introduced":34,"dead_code":0,"dupes":0,"tests_pass":0,"lint_pass":1,"typecheck_pass":1},"status":"keep","description":"refactor(admin): extract security overview section builders","timestamp":1784020328499,"segment":3,"confidence":4,"asi":{"hypothesis":"render() in security-overview.js had inline section templates and row builders. Extracting buildRateLimitRows, buildTtlRows, buildSecuritySection, and buildFutureSection removes the arrow CRAP finding.","files_changed":["public/js/features/admin/settings/security-overview.js"]}}
{"run":163,"commit":"f406adf","metric":156,"metrics":{"fallow_health_score":77.6,"complexity_introduced":34,"dead_code":0,"dupes":0,"tests_pass":0,"lint_pass":1,"typecheck_pass":1},"status":"keep","description":"refactor(admin): decompose applyResourceRulesImmediate state update","timestamp":1784020614437,"segment":3,"confidence":3.9166666666666665,"asi":{"hypothesis":"applyResourceRulesImmediate combined id normalization, target filtering, key resolution ternary chain, and update payload mapping. Extracting buildIdSet, resolveTargetResources, resolveIdKey, and buildUpdatePayload removes the CRAP finding.","files_changed":["public/js/features/admin/settings/policies-state-ops.js"]}}
{"run":164,"commit":"f406adf","metric":155,"metrics":{"fallow_health_score":77.6,"complexity_introduced":34,"dead_code":0,"dupes":0,"tests_pass":0,"lint_pass":1,"typecheck_pass":1},"status":"keep","description":"refactor(account): decompose password change submit handler","timestamp":1784020903738,"segment":3,"confidence":4,"asi":{"hypothesis":"The password form submit arrow mixed validation, API call, success/error handling, and form reset. Extracting clearPasswordFeedback, validatePasswordForm, postPasswordChange, handlePasswordResponse, and handlePasswordError removes the arrow CRAP finding.","files_changed":["public/js/features/account/account-security.js"]}}
{"run":165,"commit":"f406adf","metric":154,"metrics":{"fallow_health_score":77.6,"complexity_introduced":34,"dead_code":0,"dupes":0,"tests_pass":0,"lint_pass":1,"typecheck_pass":1},"status":"keep","description":"refactor(admin): decompose updateDefaultModel optimistic update","timestamp":1784021191825,"segment":3,"confidence":4.083333333333333,"asi":{"hypothesis":"updateDefaultModel combined optimistic state update, API call, success commit, and rollback. Extracting applyDefaultModelOptimistic, revertDefaultModel, commitDefaultModel, and postDefaultModelUpdate removes the CRAP finding.","files_changed":["public/js/features/admin/settings/general.js"]}}
{"run":166,"commit":"f406adf","metric":153,"metrics":{"fallow_health_score":77.6,"complexity_introduced":34,"dead_code":0,"dupes":0,"tests_pass":0,"lint_pass":1,"typecheck_pass":1},"status":"keep","description":"refactor(admin): decompose loadAdminConfig field parsing","timestamp":1784021511558,"segment":3,"confidence":4,"asi":{"hypothesis":"loadAdminConfig parsed public_registration, registration_status, and default_model_id inline. Extracting parsePublicRegistration, parseRegistrationStatus, parseDefaultModelId, and applyAdminConfig removes the CRAP finding.","files_changed":["public/js/features/admin/settings/general.js"]}}
{"run":167,"commit":"f406adf","metric":152,"metrics":{"fallow_health_score":77.6,"complexity_introduced":33,"dead_code":0,"dupes":0,"tests_pass":0,"lint_pass":1,"typecheck_pass":1},"status":"keep","description":"refactor(admin): decompose add-user saveCurrent handler","timestamp":1784021790200,"segment":3,"confidence":3.923076923076923,"asi":{"hypothesis":"saveCurrent's async IIFE mixed CSV import, user form submission, and error display. Extracting submitCsvImport, submitUserForm, and showSaveUserError removes the arrow CRAP finding and reduces complexity_introduced.","files_changed":["public/js/features/admin/users/overview.js"]}}
{"run":168,"commit":"f406adf","metric":151,"metrics":{"fallow_health_score":77.6,"complexity_introduced":33,"dead_code":0,"dupes":0,"tests_pass":0,"lint_pass":1,"typecheck_pass":1},"status":"keep","description":"refactor(chat): decompose appendMessageBlock into tool/content helpers","timestamp":1784022072787,"segment":3,"confidence":4,"asi":{"hypothesis":"appendMessageBlock handled tool-block deduplication and content merging inline. Extracting findToolBlock, appendToolBlock, and mergeOrAppendContent removes the CRAP finding.","files_changed":["src/chat/assistant-stream-utils.js"]}}
{"run":169,"commit":"f406adf","metric":150,"metrics":{"fallow_health_score":77.6,"complexity_introduced":32,"dead_code":0,"dupes":0,"tests_pass":0,"lint_pass":1,"typecheck_pass":1},"status":"keep","description":"refactor(admin): decompose buildBulkAclStatements validation loop","timestamp":1784022342177,"segment":3,"confidence":4.076923076923077,"asi":{"hypothesis":"buildBulkAclStatements mixed id normalization, editable check, rule validation, and statement building in one loop. Extracting normalizeConnectionUpdate, requireEditableConnection, and validateConnectionRuleUpdate removes the CRAP finding and reduces complexity_introduced.","files_changed":["src/routers/admin/admin-connections-access.js"]}}
{"run":170,"commit":"f406adf","metric":149,"metrics":{"fallow_health_score":77.6,"complexity_introduced":31,"dead_code":0,"dupes":0,"tests_pass":0,"lint_pass":1,"typecheck_pass":1},"status":"keep","description":"refactor(account): decompose buildPayload field resolution","timestamp":1784022622585,"segment":3,"confidence":4,"asi":{"hypothesis":"buildPayload resolved multiple connection fields inline with optional chains. Extracting resolveConnectionName, resolveConnectionKey, resolveConnectionHeaders, resolveConnectionAuthType, and resolveConnectionEnabled removes the CRAP finding and reduces complexity_introduced.","files_changed":["public/js/features/account/account-connections-modal-ui.js"]}}
{"run":171,"commit":"f406adf","metric":148,"metrics":{"fallow_health_score":77.6,"complexity_introduced":31,"dead_code":0,"dupes":0,"tests_pass":0,"lint_pass":1,"typecheck_pass":1},"status":"keep","description":"refactor(account): decompose testConnection lifecycle","timestamp":1784022889944,"segment":3,"confidence":3.9285714285714284,"asi":{"hypothesis":"testConnection mixed payload preparation, model normalization, success/error UI updates, and loading state teardown. Extracting prepareTestConnection, normalizeDiscoveredModels, applyTestSuccess, applyTestError, and finishTestLoading removes the CRAP finding.","files_changed":["public/js/features/account/account-connections-modal-ui.js"]}}
{"run":172,"commit":"f406adf","metric":146,"metrics":{"fallow_health_score":77.6,"complexity_introduced":31,"dead_code":0,"dupes":0,"tests_pass":0,"lint_pass":1,"typecheck_pass":1},"status":"keep","description":"refactor(admin): simplify getRuleAccessState and renderRuleItem","timestamp":1784023232953,"segment":3,"confidence":4.071428571428571,"asi":{"hypothesis":"getRuleAccessState had a chain of if branches; converting to RULE_ACCESS_STATES lookup removes the CRAP finding. The inline map arrow in renderRuleList was also above threshold; extracting renderRuleItem, ruleItemClasses, renderHiddenBadge, and renderDisabledBadge removes it.","files_changed":["public/js/features/admin/users/overview-helpers.js"]}}
{"run":173,"commit":"f406adf","metric":145,"metrics":{"fallow_health_score":77.6,"complexity_introduced":31,"dead_code":0,"dupes":0,"tests_pass":0,"lint_pass":1,"typecheck_pass":1},"status":"keep","description":"refactor(shared): decompose showPreferencesModal","timestamp":1784023576815,"segment":3,"confidence":4.142857142857143,"asi":{"hypothesis":"showPreferencesModal mixed large template, update collection, API save, and lifecycle. Extracting buildPreferencesModalHtml, buildSelectOptions, collectPreferenceUpdates, and postPreferenceUpdates removes the CRAP finding.","files_changed":["public/js/shared/components/user-profile-footer-controller.js"]}}
{"run":174,"commit":"f406adf","metric":144,"metrics":{"fallow_health_score":77.6,"complexity_introduced":31,"dead_code":0,"dupes":0,"tests_pass":0,"lint_pass":1,"typecheck_pass":1},"status":"keep","description":"refactor(chat): decompose sendMessage","timestamp":1784023852712,"segment":3,"confidence":4.068965517241379,"asi":{"hypothesis":"sendMessage mixed prompt normalization, optimistic state preparation, stream runtime awaits, and error rollback. Extracting preparePrompt, rollbackOptimisticSend, and finishSendError removes the CRAP finding.","files_changed":["public/js/features/chat/chat.js"]}}
