{"run":240,"commit":"$(cd /m","metric":82,"metrics":{"fallow_health_score":77.6,"complexity_introduced":11,"dead_code":0,"dupes":0,"tests_pass":1,"lint_pass":1,"typecheck_pass":1},"status":"keep","description":"Extract buildDisplayBlocks, renderErrorContent, resolveDisplayAnswer from renderAssistantMessageBody (24→12 cyc). functions_above_threshold 83→82.","timestamp":1784101067437,"segment":3,"confidence":3.723076923076923}
{"run":242,"commit":"0cb0c3b","metric":80,"metrics":{"fallow_health_score":77.6,"complexity_introduced":11,"dead_code":0,"dupes":0,"tests_pass":1,"lint_pass":1,"typecheck_pass":1},"status":"keep","description":"Extract renderModelRow from buildConnectionModalModelsMarkup. functions_above_threshold 82→80.","timestamp":1784118247696,"segment":3,"confidence":3.727272727272727,"asi":{"hypothesis":"Extract renderModelRow from buildConnectionModalModelsMarkup — removes the map arrow CRAP finding","next":"Try extracting buildConnectionModalBodyMarkup next","rollback":"renderModelRow worked"}}
{"run":243,"commit":"HEAD","metric":82,"metrics":{"fallow_health_score":77.6,"complexity_introduced":11,"dead_code":0,"dupes":0,"tests_pass":1,"lint_pass":1,"typecheck_pass":1},"status":"keep","description":"Revert broken buildConnectionModalBodyMarkup refactor and fix pre-existing test regressions in temp-chat promotion, autoTitle, and ACL family label","timestamp":1784132780273,"segment":3,"confidence":3.727272727272727,"asi":{"hypothesis":"The previous commit (0cb0c3b9) extracted fields from buildConnectionModalBodyMarkup but removed required DOM IDs, breaking account-connections tests. Additionally, three pre-existing test failures were blocking the suite: users.test expected mcp_server family label while code emits tool_server; prepareOptimisticConversation did not return autoTitle or set tempChatId for existing temp chats, so promotion did not move tool selections. Reverting the broken refactor and fixing these semantic regressions restores the full test suite to green.","next_action_hint":"Resume complexity_introduced reduction by targeting small introduced functions (cyc 11-13) in changed files such as handleServerToggle, renderModels, or parseSendBody.","rollback_reason":null}}
{"run":244,"commit":"06bf690","metric":81,"metrics":{"fallow_health_score":77.6,"complexity_introduced":10,"dead_code":0,"dupes":0,"tests_pass":1,"lint_pass":1,"typecheck_pass":1},"status":"keep","description":"refactor(account): split handleServerToggle into shared/personal handlers","timestamp":1784133566888,"segment":3,"confidence":3.671641791044776,"asi":{"hypothesis":"handleServerToggle in account-integrations-events.js had cyc=13 because it combined shared-server visibility toggle logic and personal-server enabled toggle logic in one function. Splitting into handleSharedServerToggle and handlePersonalServerToggle, with the parent dispatching by scope, reduces the parent below the CRAP threshold and removes one function from the introduced complexity count.","next_action_hint":"Continue decomposing remaining complexity_introduced functions with cyc just above threshold, such as renderModels, parseSendBody, sanitizeConnectionInput, or validateUpdateRequest."}}
{"run":245,"commit":"06bf690","metric":80,"metrics":{"fallow_health_score":77.6,"complexity_introduced":9,"dead_code":0,"dupes":0,"tests_pass":1,"lint_pass":1,"typecheck_pass":1},"status":"keep","description":"refactor(account): decompose renderModels into small state helpers","timestamp":1784134018954,"segment":3,"confidence":3.6176470588235294,"asi":{"hypothesis":"renderModels in account-connections-modal-ui.js had cyc=12 from a chain of guard/early-return branches. Extracting isModelsRendererMounted, shouldRenderModelsEmptyState, and renderModelsList removes enough branches to drop the parent below the threshold and reduces complexity_introduced by 1.","next_action_hint":"Target remaining small introduced functions: parseSendBody, sanitizeConnectionInput, validateUpdateRequest, or the chat-realtime-controller message handlers."}}
{"run":246,"commit":"06bf690","metric":79,"metrics":{"fallow_health_score":77.6,"complexity_introduced":8,"dead_code":0,"dupes":0,"tests_pass":1,"lint_pass":1,"typecheck_pass":1},"status":"keep","description":"refactor(chat): decompose parseSendBody into small validation/resolution helpers","timestamp":1784134425107,"segment":3,"confidence":3.6470588235294117,"asi":{"hypothesis":"parseSendBody in chat-message-send.js mixed JSON parsing, content validation, model resolution, tool-name normalization, and attachment validation. Extracting parseSendJsonBody, resolveSendContent, validateSendContent, resolveSendSelectedToolNames, resolveSendModel, and validateAttachmentCount removes enough branches to drop the parent below the CRAP threshold and reduces complexity_introduced by 1.","next_action_hint":"Target remaining introduced functions: sanitizeConnectionInput, validateUpdateRequest, handleMessageCreatedOrCompleted, handleMessageDelta, or the anonymous arrows in models-public-list.test.js and integrations-event-handlers.js."}}
{"run":247,"commit":"06bf690","metric":78,"metrics":{"fallow_health_score":77.6,"complexity_introduced":7,"dead_code":0,"dupes":0,"tests_pass":1,"lint_pass":1,"typecheck_pass":1},"status":"keep","description":"refactor(chat): split handleMessageCreatedOrCompleted into focused lifecycle helpers","timestamp":1784134871460,"segment":3,"confidence":3.676470588235294,"asi":{"hypothesis":"handleMessageCreatedOrCompleted in chat-realtime-controller.js combined chat sync, message application, and active-chat message loading with nested branches. Extracting syncChatFromCreatedEvent, applyCreatedMessage, and loadActiveChatMessages makes each helper single-responsibility and drops the parent below the CRAP threshold.","next_action_hint":"Continue with remaining introduced functions: handleMessageDelta, sanitizeConnectionInput, validateUpdateRequest, or the anonymous arrows in models-public-list.test.js and integrations-event-handlers.js."}}
{"run":248,"commit":"06bf690","metric":77,"metrics":{"fallow_health_score":77.6,"complexity_introduced":6,"dead_code":0,"dupes":0,"tests_pass":1,"lint_pass":1,"typecheck_pass":1},"status":"keep","description":"refactor(chat): extract delta predicates from handleMessageDelta","timestamp":1784135256249,"segment":3,"confidence":3.652173913043478,"asi":{"hypothesis":"handleMessageDelta in chat-realtime-controller.js had cyc=12 from active-chat guard, stream-abort/origin guard, and empty-delta guard. Extracting isActiveChatDelta, shouldIgnoreDelta, and resolveDeltaModel collapses the guard logic and drops the parent below the CRAP threshold.","next_action_hint":"Target remaining introduced functions: sanitizeConnectionInput, validateUpdateRequest, or the anonymous arrows in models-public-list.test.js and integrations-event-handlers.js."}}
{"run":249,"commit":"06bf690","metric":76,"metrics":{"fallow_health_score":77.6,"complexity_introduced":5,"dead_code":0,"dupes":0,"tests_pass":1,"lint_pass":1,"typecheck_pass":1},"status":"keep","description":"refactor(admin): extract provider/url/key/header helpers from sanitizeConnectionInput","timestamp":1784135672914,"segment":3,"confidence":3.6285714285714286,"asi":{"hypothesis":"sanitizeConnectionInput in admin-connections-save.js had cyc=12 from provider resolution, URL validation, key length check, and headers length check. Extracting resolveConnectionProviderType, resolveConnectionUrl, validateConnectionKeyLength, validateConnectionHeadersLength, and buildSanitizedConnectionRecord removes the branches from the parent and reduces complexity_introduced by 1.","next_action_hint":"Target remaining introduced functions: validateUpdateRequest, the anonymous arrows in models-public-list.test.js and integrations-event-handlers.js, and account-integrations-events.js."}}
{"run":250,"commit":"HEAD","metric":76,"metrics":{"fallow_health_score":77.6,"complexity_introduced":5,"dead_code":0,"dupes":0,"tests_pass":1,"lint_pass":1,"typecheck_pass":1},"status":"discard","description":"refactor(test): extract mock load helpers in models-public-list.test.js","timestamp":1784136140784,"segment":3,"confidence":3.6285714285714286,"asi":{"hypothesis":"The anonymous loadModels mock in models-public-list.test.js had cyc=12 from two try/catch blocks. Extracting mockLoadBaseModels and mockLoadCustomModels should reduce the parent arrow below threshold.","next_action_hint":"Target validateUpdateRequest or the anonymous arrows in account-integrations-events.js and integrations-event-handlers.js instead.","rollback_reason":"functions_above_threshold and complexity_introduced unchanged; the extracted helpers did not reduce the parent arrow's cyclomatic complexity below the threshold."}}
{"run":251,"commit":"06bf690","metric":75,"metrics":{"fallow_health_score":77.6,"complexity_introduced":4,"dead_code":0,"dupes":0,"tests_pass":1,"lint_pass":1,"typecheck_pass":1},"status":"keep","description":"refactor(models): decompose validateUpdateRequest into validation pipeline helpers","timestamp":1784136641236,"segment":3,"confidence":3.657142857142857,"asi":{"hypothesis":"validateUpdateRequest in models-admin-settings-update.js had cyc=12 from a long sequence of error-return branches for auth, db, body parsing, counts, sanitization, preparation, ACL, and non-empty checks. Extracting requireUpdateAdminAccess, parseAndValidateUpdateBody, sanitizeUpdateEnabled, prepareUpdateAccess, and ensureNonEmptyUpdate removes enough branches to drop the parent below threshold and reduces complexity_introduced by 1.","next_action_hint":"Target remaining introduced functions: the anonymous arrows in account-integrations-events.js and integrations-event-handlers.js, and matchesTempMessage."}}
{"run":252,"commit":"06bf690","metric":74,"metrics":{"fallow_health_score":77.6,"complexity_introduced":3,"dead_code":0,"dupes":0,"tests_pass":1,"lint_pass":1,"typecheck_pass":1},"status":"keep","description":"refactor(account): convert integration list click handler to dispatch table","timestamp":1784137097429,"segment":3,"confidence":3.6338028169014085,"asi":{"hypothesis":"The delegated click handler arrow in account-integrations-events.js had cyc=12 from six sequential target.closest branches. Replacing the simple four branches with a handler table and extracting handleIntegrationEditClick collapses the arrow body to a single dispatch call and drops handleIntegrationListClick below the CRAP threshold.","next_action_hint":"Target remaining introduced functions: matchesTempMessage in chat-realtime-controller.js and the anonymous arrow in integrations-event-handlers.js."}}
{"run":253,"commit":"HEAD","metric":74,"metrics":{"fallow_health_score":77.6,"complexity_introduced":3,"dead_code":0,"dupes":0,"tests_pass":1,"lint_pass":1,"typecheck_pass":1},"status":"discard","description":"refactor(chat): collapse matchesTempMessage into single boolean expression","timestamp":1784137544318,"segment":3,"confidence":3.5833333333333335,"asi":{"hypothesis":"matchesTempMessage had cyc=12 from four sequential if-return branches. Collapsing into a single boolean expression should reduce cyclomatic complexity.","next_action_hint":"Target the integrations-event-handlers.js anonymous arrow or the models-public-list.test.js arrow instead. For matchesTempMessage, extract the string-normalization into a helper or split the role/content/parent checks into smaller predicates.","rollback_reason":"functions_above_threshold and complexity_introduced unchanged; the boolean expression still has enough decision points to stay above the CRAP threshold."}}
{"run":254,"commit":"06bf690","metric":73,"metrics":{"fallow_health_score":77.6,"complexity_introduced":2,"dead_code":0,"dupes":0,"tests_pass":1,"lint_pass":1,"typecheck_pass":1},"status":"keep","description":"refactor(admin): extract OAuth start body and success helpers from click handler","timestamp":1784137948120,"segment":3,"confidence":3.611111111111111,"asi":{"hypothesis":"The connect-oauth click handler arrow in integrations-event-handlers.js had cyc=11 from guard, try/catch, and nested status update checks. Extracting buildOAuthStartBody and handleOAuthStartSuccess drops the arrow below the CRAP threshold.","next_action_hint":"Target remaining introduced functions: matchesTempMessage in chat-realtime-controller.js and the models-public-list.test.js arrow."}}
{"run":255,"commit":"HEAD","metric":73,"metrics":{"fallow_health_score":77.6,"complexity_introduced":2,"dead_code":0,"dupes":0,"tests_pass":1,"lint_pass":1,"typecheck_pass":1},"status":"discard","description":"refactor(test): simplify splitModelScope mock with filter","timestamp":1784138319955,"segment":3,"confidence":3.611111111111111,"asi":{"hypothesis":"The splitModelScopeByUserVisibility mock arrow had cyc=12 from a ternary inside forEach. Replacing the imperative push logic with filter should reduce cyclomatic complexity.","next_action_hint":"Focus on matchesTempMessage; the test mock may still be counted due to baseline changes or another arrow in the file may be the actual introduced finding. Inspect all arrows in models-public-list.test.js.","rollback_reason":"functions_above_threshold and complexity_introduced unchanged; the refactored mock did not remove the introduced finding, possibly because a different arrow in the test file is the flagged one."}}
{"run":256,"commit":"06bf690","metric":72,"metrics":{"fallow_health_score":77.6,"complexity_introduced":1,"dead_code":0,"dupes":0,"tests_pass":1,"lint_pass":1,"typecheck_pass":1},"status":"keep","description":"refactor(chat): split matchesTempMessage into focused predicate helpers","timestamp":1784138782889,"segment":3,"confidence":3.638888888888889,"asi":{"hypothesis":"matchesTempMessage had cyc=12 from sequential if-return checks with optional-chain and fallback operators. Splitting into small single-concern predicates (hasTempIdPrefix, hasMatchingRole, hasMatchingParent, hasMatchingAssistantContent) drops the parent below the CRAP threshold and reduces complexity_introduced by 1.","next_action_hint":"Target the last remaining introduced function: the anonymous arrow in models-public-list.test.js."}}
{"run":257,"commit":"HEAD","metric":72,"metrics":{"fallow_health_score":77.6,"complexity_introduced":1,"dead_code":0,"dupes":0,"tests_pass":1,"lint_pass":1,"typecheck_pass":1},"status":"discard","description":"refactor(test): split splitModelScope mock into helpers","timestamp":1784139183323,"segment":3,"confidence":3.638888888888889,"asi":{"hypothesis":"The splitModelScopeByUserVisibility mock arrow had cyc=12 from a ternary inside forEach. Extracting isModelHidden, partitionModelsByVisibility, and buildModelScopeResult should drop the arrow below the CRAP threshold.","next_action_hint":"The test file appears to be flagged as a whole due to prior modifications. Consider abandoning this introduced function and instead reduce the overall functions_above_threshold by decomposing non-introduced high-CRAP functions elsewhere, or accept that complexity_introduced=1 is the practical floor.","rollback_reason":"functions_above_threshold and complexity_introduced unchanged; the refactored mock arrow or one of its new helpers still exceeds the CRAP threshold."}}
{"run":258,"commit":"06bf690","metric":71,"metrics":{"fallow_health_score":77.6,"complexity_introduced":1,"dead_code":0,"dupes":0,"tests_pass":1,"lint_pass":1,"typecheck_pass":1},"status":"keep","description":"refactor(shared): decompose normalizeConnectionManualModels forEach arrow","timestamp":1784140078286,"segment":3,"confidence":3.6666666666666665,"asi":{"hypothesis":"The forEach callback in normalizeConnectionManualModels had cyc=13 from sequential raw-id, safe-id, seen, and name branches. Extracting normalizeManualModelItem, resolveManualModelRawId, and resolveManualModelName drops the arrow and helpers below the CRAP threshold, reducing functions_above_threshold by 1.","next_action_hint":"Continue targeting single-function non-introduced high-CRAP files (e.g., email-delivery.js saveApiKey, chat-list-actions.js delete, admin/settings/integrations.js arrow) to keep reducing functions_above_threshold."}}
{"run":259,"commit":"06bf690","metric":70,"metrics":{"fallow_health_score":77.6,"complexity_introduced":1,"dead_code":0,"dupes":0,"tests_pass":1,"lint_pass":1,"typecheck_pass":1},"status":"keep","description":"refactor(admin): extract validation/save/rollback helpers from saveApiKey","timestamp":1784140525973,"segment":3,"confidence":3.6944444444444446,"asi":{"hypothesis":"saveApiKey in email-delivery.js had cyc=12 from input validation, API call, response check, success commit, and error rollback branches. Extracting validateApiKeyInput, postApiKeyUpdate, commitApiKeySaved, and rollbackApiKeyConfigured drops the parent below the CRAP threshold.","next_action_hint":"Continue decomposing single-function non-introduced files to drive functions_above_threshold lower. Next candidates: chat-list-actions.js delete, admin/settings/integrations.js arrow, admin/settings/security.js, admin/users/overview-render.js, admin/users/roles.js, chat-message-stream-temp-chat.js, src/chat/assistant-runner.js, src/llm/connections.js."}}
{"run":260,"commit":"HEAD","metric":71,"metrics":{"fallow_health_score":77.6,"complexity_introduced":2,"dead_code":0,"dupes":0,"tests_pass":1,"lint_pass":1,"typecheck_pass":1},"status":"discard","description":"refactor(admin): extract validation/save/rollback helpers from updateResendApiKey","timestamp":1784140910588,"segment":3,"confidence":3.643835616438356,"asi":{"hypothesis":"updateResendApiKey in security.js had cyc=12 from validation, API call, response check, success commit, and error rollback branches. Extracting helpers should drop the parent below the CRAP threshold.","next_action_hint":"Try a different single-function file where the decomposition pattern worked (e.g., chat-list-actions.js delete), or extract smaller helpers that don't individually exceed the threshold.","rollback_reason":"functions_above_threshold unchanged and complexity_introduced increased from 1 to 2; the parent or extracted helpers in security.js still exceed the CRAP threshold and are now marked introduced."}}
{"run":261,"commit":"06bf690","metric":69,"metrics":{"fallow_health_score":77.6,"complexity_introduced":1,"dead_code":0,"dupes":0,"tests_pass":1,"lint_pass":1,"typecheck_pass":1},"status":"keep","description":"refactor(chat): decompose delete handler into state-cleanup helpers","timestamp":1784141318945,"segment":3,"confidence":3.6216216216216215,"asi":{"hypothesis":"The delete handler in chat-list-actions.js had cyc=12 from confirm, state updates, next-id resolution, map cleanup, remote delete, and rollback branches. Extracting buildRemovedChat, omitMessageMapEntry, buildNextChatState, resolveNextActiveChatId, cleanupAfterDelete, and deleteRemoteChatAndRollback drops the parent below the CRAP threshold.","next_action_hint":"Continue targeting remaining single-function non-introduced files: admin/settings/integrations.js arrow, admin/users/overview-render.js, admin/users/roles.js, chat-message-stream-temp-chat.js arrow, src/chat/assistant-runner.js, src/llm/connections.js."}}
{"run":262,"commit":"06bf690","metric":68,"metrics":{"fallow_health_score":77.6,"complexity_introduced":1,"dead_code":0,"dupes":0,"tests_pass":1,"lint_pass":1,"typecheck_pass":1},"status":"keep","description":"refactor(admin): extract avatar and action helpers from renderUserRows","timestamp":1784141726139,"segment":3,"confidence":3.6486486486486487,"asi":{"hypothesis":"The renderUserRows map callback had cyc=10 and CRAP just above threshold (31.6). Extracting buildUserAvatarHtml, formatUserInitials, and buildUserActionsHtml removes the avatar and admin-check branches, dropping the arrow below the CRAP threshold.","next_action_hint":"Continue with remaining single-function non-introduced files: admin/settings/integrations.js arrow, admin/settings/security.js, admin/users/roles.js, chat-message-stream-temp-chat.js arrow, src/chat/assistant-runner.js, src/llm/connections.js."}}
{"run":263,"commit":"06bf690","metric":67,"metrics":{"fallow_health_score":77.6,"complexity_introduced":1,"dead_code":0,"dupes":0,"tests_pass":1,"lint_pass":1,"typecheck_pass":1},"status":"keep","description":"refactor(chat): extract promotion helpers from promoteOptimisticConversation setState arrow","timestamp":1784142107826,"segment":3,"confidence":3.675675675675676,"asi":{"hypothesis":"The setState arrow in promoteOptimisticConversation had cyc=12 from temp-chat replacement, deduping, and map migrations. Extracting buildPromotedChatList, moveChatMapEntry, and moveChatToolSelections collapses the arrow to a pure object expression.","next_action_hint":"Continue with remaining single-function non-introduced files: admin/settings/integrations.js, admin/settings/security.js, admin/users/roles.js, src/chat/assistant-runner.js, src/llm/connections.js."}}
{"run":264,"commit":"06bf690","metric":66,"metrics":{"fallow_health_score":77.6,"complexity_introduced":1,"dead_code":0,"dupes":0,"tests_pass":1,"lint_pass":1,"typecheck_pass":1},"status":"keep","description":"refactor(llm): extract connection normalization helpers from getStoredOpenAIConnectionConfigs map callback","timestamp":1784142482712,"segment":3,"confidence":3.6533333333333333,"asi":{"hypothesis":"The normalized map callback in getStoredOpenAIConnectionConfigs had cyc=12 from URL validation, provider resolution, name fallback, enabled check, and manual-models-mode fallback. Extracting resolveConnectionUrl, resolveConnectionProvider, buildStoredConnectionRecord, and small resolvers collapses the callback to a single guard branch.","next_action_hint":"Continue with remaining single-function non-introduced files: admin/settings/integrations.js, admin/settings/security.js, admin/users/roles.js, src/chat/assistant-runner.js."}}
