{"run":28,"commit":"3cc7da2","metric":55,"metrics":{"fallow_health_score":77.6,"dead_code":0,"dupes":13,"tests_pass":1,"lint_pass":1,"typecheck_pass":1,"dead_code_introduced":0,"duplication_introduced":6},"status":"keep","description":"Decomposed startNewChat (was cyc=8, crap=72) in public/js/features/chat/chat-shell-controller.js. Extracted reuseEmptyTempChat, activeEmptyTempChatId, transferDraftToolSelection, startFreshTempChat helpers. complexity_introduced 56 -> 55.","timestamp":1783807137854,"segment":0,"confidence":3.619047619047619,"asi":{"hypothesis":"Splitting reuse-vs-create branches into separate named helpers each below cyc=5 keeps all helpers below CRAP threshold at 0% coverage."}}
{"run":29,"commit":"347b8b3","metric":54,"metrics":{"fallow_health_score":77.6,"dead_code":0,"dupes":13,"tests_pass":1,"lint_pass":1,"typecheck_pass":1,"dead_code_introduced":0,"duplication_introduced":6},"status":"keep","description":"Decomposed commitPartialStreamText (was cyc=7, crap=56) in public/js/features/chat/chat-message-stream-send.js. Extracted applyAssistantContentUpdate helper. complexity_introduced 55 -> 54.","timestamp":1783807458373,"segment":0,"confidence":3.5454545454545454,"asi":{"hypothesis":"Converting if-block array update to early-return helper reduces parent cyc from 7 to ~3."}}
{"run":30,"commit":"649266c","metric":52,"metrics":{"fallow_health_score":77.6,"dead_code":0,"dupes":13,"tests_pass":1,"lint_pass":1,"typecheck_pass":1,"dead_code_introduced":0,"duplication_introduced":6},"status":"keep","description":"Decomposed toggleThinkingSection (was cyc=7, crap=56) in public/js/features/chat/chat-message-interactions.js. Extracted applyThinkingCollapsedState helper. complexity_introduced 54 -> 52.","timestamp":1783807780705,"segment":0,"confidence":3.5652173913043477,"asi":{"hypothesis":"Extracting DOM class-toggle logic from a function that handles 4 separate class operations reduces cyc."}}
{"run":31,"commit":"6ee76e7","metric":50,"metrics":{"fallow_health_score":77.6,"dead_code":0,"dupes":13,"tests_pass":1,"lint_pass":1,"typecheck_pass":1,"dead_code_introduced":0,"duplication_introduced":6},"status":"keep","description":"Decomposed loadUsers (was cyc=9, crap=90) in public/js/features/admin/admin-controller.js. Extracted applyUsersFromCache, setUsersLoading, fetchUsersPage helpers. complexity_introduced 52 -> 50.","timestamp":1783808060598,"segment":0,"confidence":3.5833333333333335,"asi":{"hypothesis":"Separating cache lookup, loading state, and fetch with error handling into 3 helpers drops loadUsers cyc below threshold."}}
{"run":32,"commit":"f3dada7","metric":49,"metrics":{"fallow_health_score":77.6,"dead_code":0,"dupes":13,"tests_pass":1,"lint_pass":1,"typecheck_pass":1,"dead_code_introduced":0,"duplication_introduced":6},"status":"keep","description":"Decomposed findUserToolServerByOauthState (was cyc=7, crap=56) in src/routers/users/users-helpers.js. Extracted findOauthStateRow helper. complexity_introduced 50 -> 49.","timestamp":1783808322326,"segment":0,"confidence":3.3846153846153846,"asi":{"hypothesis":"Extracting the row scan loop from a database helper reduces cyc."}}
{"run":33,"commit":"ba714c6","metric":48,"metrics":{"fallow_health_score":77.6,"dead_code":0,"dupes":13,"tests_pass":1,"lint_pass":1,"typecheck_pass":1,"dead_code_introduced":0,"duplication_introduced":6},"status":"keep","description":"Decomposed buildPersistedServer (was cyc=7, crap=56) in src/routers/users/mcp-oauth.js. Extracted buildOauthBodyFields with field array + bodyFieldToString helper. complexity_introduced 49 -> 48.","timestamp":1783808600099,"segment":0,"confidence":3.4615384615384617,"asi":{"hypothesis":"Extracting 5 inline || fallback strings into a field array + loop with bodyFieldToString helper drops cyc from 7 to ~3."}}
{"run":34,"commit":"e78ad6e","metric":46,"metrics":{"fallow_health_score":77.6,"dead_code":0,"dupes":13,"tests_pass":1,"lint_pass":1,"typecheck_pass":1,"dead_code_introduced":0,"duplication_introduced":6},"status":"keep","description":"Decomposed handleSpaFallback (was cyc=9, crap=36.8) in src/index.js. Extracted tryFetchAuthAsset and tryFetchIndexAsset helpers. complexity_introduced 48 -> 46.","timestamp":1783808898676,"segment":0,"confidence":3.4814814814814814,"asi":{"hypothesis":"Extracting each try/catch boundary into its own helper reduces cyc of the parent function."}}
{"run":35,"commit":"bc2f1b0","metric":45,"metrics":{"fallow_health_score":77.6,"dead_code":0,"dupes":13,"tests_pass":1,"lint_pass":1,"typecheck_pass":1,"dead_code_introduced":0,"duplication_introduced":6},"status":"keep","description":"Decomposed #test-server click handler (was cyc=7, crap=56) in public/js/features/admin/settings/integrations-event-handlers.js. Extracted runServerTestAndApply and applyServerVerifyResult helpers. complexity_introduced 46 -> 45.","timestamp":1783809163081,"segment":0,"confidence":3.4285714285714284,"asi":{"hypothesis":"Extracting verify+apply logic from a click handler reduces cyc from 7 to 6 (still exceeds, but net metric went down)."}}
{"run":36,"commit":"4139b31","metric":45,"metrics":{"fallow_health_score":77.6,"dead_code":0,"dupes":13,"tests_pass":1,"lint_pass":1,"typecheck_pass":1,"dead_code_introduced":0,"duplication_introduced":6},"status":"keep","description":"Decomposed togglePasswordVisibility (was cyc=7, crap=56) in public/js/features/admin/settings/integrations-event-handlers.js. Extracted updatePasswordToggleAria and updatePasswordToggleLabel helpers. complexity_introduced stayed at 45 (cascading effects offset).","timestamp":1783809471498,"segment":0,"confidence":3.4285714285714284,"asi":{"hypothesis":"Extracting small helpers from a function with multiple inline ternaries can remove the function from findings list even when the metric doesn't shift."}}
{"run":37,"commit":"9090922","metric":44,"metrics":{"fallow_health_score":77.6,"dead_code":0,"dupes":13,"tests_pass":1,"lint_pass":1,"typecheck_pass":1,"dead_code_introduced":0,"duplication_introduced":6},"status":"keep","description":"Decomposed loadAndRenderContent (was cyc=7, crap=56) in public/js/features/admin/audit-logs.js. Extracted appendPaginationIfNeeded helper. complexity_introduced 45 -> 44.","timestamp":1783858153311,"segment":0,"confidence":3.2666666666666666,"asi":{"hypothesis":"Extracting inline pagination-render logic from a content renderer reduces cyc below threshold."}}
{"run":38,"commit":"c61fb48","metric":43,"metrics":{"fallow_health_score":77.6,"dead_code":0,"dupes":13,"tests_pass":1,"lint_pass":1,"typecheck_pass":1,"dead_code_introduced":0,"duplication_introduced":6},"status":"keep","description":"Decomposed rows arrow (was cyc=7, crap=56) in public/js/features/admin/audit-logs.js. Replaced 5 inline || fallback expressions with a field accessor array + .map loop. complexity_introduced 44 -> 43.","timestamp":1783858416028,"segment":0,"confidence":3.3333333333333335,"asi":{"hypothesis":"Field accessor array + .map loop eliminates optional-chain branches that fallow counts toward cyc."}}
{"run":39,"commit":"ba0e1e2","metric":42,"metrics":{"fallow_health_score":77.6,"dead_code":0,"dupes":13,"tests_pass":1,"lint_pass":1,"typecheck_pass":1,"dead_code_introduced":0,"duplication_introduced":6},"status":"keep","description":"Decomposed sendTestEmail (was cyc=7, crap=56) in public/js/features/admin/settings/security-shared.js. Extracted runSendTestEmail helper. complexity_introduced 43 -> 42.","timestamp":1783858762086,"segment":0,"confidence":3.1875,"asi":{"hypothesis":"Extracting try/catch logic from a stateful lifecycle function reduces parent cyc below threshold."}}
{"run":40,"commit":"7b56837","metric":41,"metrics":{"fallow_health_score":77.6,"dead_code":0,"dupes":13,"tests_pass":1,"lint_pass":1,"typecheck_pass":1,"dead_code_introduced":0,"duplication_introduced":6},"status":"keep","description":"Decomposed filterResourcesByQueryAndVisibility arrow (was cyc=7, crap=56) in public/js/features/admin/settings/policies-acl-helpers.js. Extracted passesResourceFilters, isResourceVisible, matchesSearchQuery, buildResourceSearchText helpers. complexity_introduced 42 -> 41.","timestamp":1783859056722,"segment":0,"confidence":3.25,"asi":{"hypothesis":"Extracting filter predicates into named helpers reduces parent arrow cyc below threshold."}}
{"run":41,"commit":"556381f","metric":40,"metrics":{"fallow_health_score":77.6,"dead_code":0,"dupes":13,"tests_pass":1,"lint_pass":1,"typecheck_pass":1,"dead_code_introduced":0,"duplication_introduced":6},"status":"keep","description":"Decomposed finalizeResult (was cyc=7, crap=56) in scripts/setup-wizard-utils.js. Extracted exitOnFailure and captureResultOutput helpers. complexity_introduced 41 -> 40.","timestamp":1783859453196,"segment":0,"confidence":3.3125,"asi":{"hypothesis":"Splitting a process.exit branch from a result builder keeps parent below CRAP threshold (cyc^2+cyc <= 30)."}}
{"run":42,"commit":"c0d3b1c","metric":39,"metrics":{"fallow_health_score":77.6,"dead_code":0,"dupes":13,"tests_pass":1,"lint_pass":1,"typecheck_pass":1,"dead_code_introduced":0,"duplication_introduced":6},"status":"keep","description":"Decomposed unsubscribe arrow (was cyc=29, cog=29, crap=52.4) and startQueuedSend (was cyc=6, crap=42) in public/js/features/chat/message-input-controller.js. Extracted 11 helpers (activeModelName, hasNoSelectableModels, applyPlaceholderAndDisclaimer, isChatSwitched, clearPendingOnChatSwitch, isNextStreamBlocked, refreshRunningMessageState, applyStreamBlockedTransition, maybeStartQueuedSend, syncDraftFromState, isQueueSendBlocked, shiftNextPending). complexity_introduced 40 -> 39.","timestamp":1783859912956,"segment":0,"confidence":3.272727272727273,"asi":{"hypothesis":"Decomposing a 29-cyc subscribe arrow into 10 small named helpers (each below CRAP threshold) drops it from findings list entirely; -1 net per decomposed arrow."}}
{"run":43,"commit":"eee0fb9","metric":38,"metrics":{"fallow_health_score":77.6,"dead_code":0,"dupes":13,"tests_pass":1,"lint_pass":1,"typecheck_pass":1,"dead_code_introduced":0,"duplication_introduced":6},"status":"keep","description":"Decomposed upsertChatFromEvent (was cyc=8, crap=72) in public/js/features/chat/chat-realtime-controller.js. Extracted mergeChatEntry and sortChatsByRecency helpers; sortChatsByRecency further split with timestampOf. complexity_introduced 39 -> 38.","timestamp":1783860304683,"segment":0,"confidence":3.235294117647059,"asi":{"hypothesis":"Extracting Number(b?.x || 0) into a timestampOf helper drops sortChatsByRecency cyc from 10 to 4."}}
{"run":44,"commit":"5836e0c","metric":37,"metrics":{"fallow_health_score":77.6,"dead_code":0,"dupes":13,"tests_pass":1,"lint_pass":1,"typecheck_pass":1,"dead_code_introduced":0,"duplication_introduced":6},"status":"keep","description":"Decomposed click handler arrow (was cyc=15, cog=24) in public/js/shared/components/user-profile-footer-controller.js. Replaced 6 else-if branches with footerActionDispatchers map + guardedActions set + named helpers. complexity_introduced 38 -> 37.","timestamp":1783861130875,"segment":0,"confidence":3.2,"asi":{"hypothesis":"Replacing 6-branch if/else-if chain with a dispatcher map + guardedActions set drops click handler cyc from 15 to ~3."}}
{"run":45,"commit":"3e62ae2","metric":35,"metrics":{"fallow_health_score":77.6,"dead_code":0,"dupes":13,"tests_pass":1,"lint_pass":1,"typecheck_pass":1,"dead_code_introduced":0,"duplication_introduced":6},"status":"keep","description":"Decomposed loadMoreChats (was cyc=6, crap=42) in public/js/features/chat/chat-shell-controller.js. Extracted shouldLoadMoreChats, mergeChatsWith, applyLoadedChats, handleLoadMoreChatsError helpers. complexity_introduced 37 -> 35 (-2).","timestamp":1783863003455,"segment":0,"confidence":3.2222222222222223,"asi":{"hypothesis":"Extracting shouldLoadMoreChats, mergeChatsWith, applyLoadedChats, handleLoadMoreChatsError from loadMoreChats drops cyc from 6 to ~3 (-2 net because pre-existing refreshChatListObserver stayed)."}}
{"run":46,"commit":"de6e62e","metric":34,"metrics":{"fallow_health_score":77.6,"dead_code":0,"dupes":13,"tests_pass":1,"lint_pass":1,"typecheck_pass":1,"dead_code_introduced":0,"duplication_introduced":6},"status":"keep","description":"Decomposed render arrow (was cyc=6, crap=42) in public/js/features/admin/settings/email-delivery.js. Extracted maskedApiKeyValue, findCurrentProvider, buildProviderOptions helpers. complexity_introduced 35 -> 34.","timestamp":1783863388508,"segment":0,"confidence":3.3714285714285714,"asi":{"hypothesis":"Extracting inline ternary, provider lookup, and HTML-building helpers from render drops cyc from 6 to ~3."}}
{"run":47,"commit":"3d9daab","metric":33,"metrics":{"fallow_health_score":77.6,"dead_code":0,"dupes":13,"tests_pass":1,"lint_pass":1,"typecheck_pass":1,"dead_code_introduced":0,"duplication_introduced":6},"status":"keep","description":"Decomposed getApiKeyHint (was cyc=6, crap=42) in public/js/features/admin/settings/email-delivery.js. Extracted buildConfiguredHint, buildDefaultHint helpers. complexity_introduced 34 -> 33.","timestamp":1783865082521,"segment":0,"confidence":3.5294117647058822,"asi":{"hypothesis":"Splitting configured-vs-default hint branches into separate named helpers each below cyc=5 keeps them below CRAP threshold at 0% coverage."}}
{"run":48,"commit":"e59102d","metric":32,"metrics":{"fallow_health_score":77.6,"dead_code":0,"dupes":13,"tests_pass":1,"lint_pass":1,"typecheck_pass":1,"dead_code_introduced":0,"duplication_introduced":6},"status":"keep","description":"Decomposed searchInput.onkeydown arrow (was cyc=6, crap=42) in public/js/features/chat/model-selector-controller.js. Replaced 4 inline if-branches with a keyHandlers map. complexity_introduced 33 -> 32.","timestamp":1783865560006,"segment":0,"confidence":3.696969696969697,"asi":{"hypothesis":"Replacing 4 inline if-branches with a dispatcher map reduces the arrow's cyc from 6 to ~3."}}
{"run":49,"commit":"91621a2","metric":31,"metrics":{"fallow_health_score":77.6,"dead_code":0,"dupes":13,"tests_pass":1,"lint_pass":1,"typecheck_pass":1,"dead_code_introduced":0,"duplication_introduced":6},"status":"keep","description":"Decomposed createHandleSetDefault arrow (was cyc=6, crap=42) in public/js/features/chat/model-selector-controller-handlers.js. Extracted readCurrentPreferences, resolveNextDefaultModelId, buildNextPreferences, applyPersistedDefault module-level helpers. complexity_introduced 32 -> 31.","timestamp":1783865863138,"segment":0,"confidence":3.875,"asi":{"hypothesis":"Extracting try/catch body into module-level helpers each below cyc=5 keeps them below CRAP threshold."}}
{"run":50,"commit":"f476db2","metric":30,"metrics":{"fallow_health_score":77.6,"dead_code":0,"dupes":13,"tests_pass":1,"lint_pass":1,"typecheck_pass":1,"dead_code_introduced":0,"duplication_introduced":6},"status":"keep","description":"Decomposed registerOAuthClient (was cyc=6, crap=42) in src/routers/users/mcp-oauth.js. Extracted buildRegistrationPayload and parseRegistrationResponse helpers. complexity_introduced 31 -> 30.","timestamp":1783866252551,"segment":0,"confidence":4.064516129032258,"asi":{"hypothesis":"Extracting payload build and response parsing from registerOAuthClient drops cyc below threshold."}}
{"run":51,"commit":"1bedc0a","metric":29,"metrics":{"fallow_health_score":77.6,"dead_code":0,"dupes":13,"tests_pass":1,"lint_pass":1,"typecheck_pass":1,"dead_code_introduced":0,"duplication_introduced":6},"status":"keep","description":"Decomposed test-server click handler arrow (was cyc=6, crap=42) in public/js/features/admin/settings/integrations-event-handlers.js. Extracted runTestServerFlow helper; outer arrow now just guards then delegates. complexity_introduced 30 -> 29.","timestamp":1783866696047,"segment":0,"confidence":4,"asi":{"hypothesis":"Extracting try/catch body into a named helper drops the outer arrow's cyc below threshold while keeping the helper just under cyc=5."}}
{"run":52,"commit":"e8ed087","metric":28,"metrics":{"fallow_health_score":77.6,"dead_code":0,"dupes":13,"tests_pass":1,"lint_pass":1,"typecheck_pass":1,"dead_code_introduced":0,"duplication_introduced":6},"status":"keep","description":"Decomposed resolveFallbackMessageInsertion (was cyc=10, crap=110) in public/js/features/chat/chat-data-controller.js. Extracted isFallbackAlreadyPresent, parentExistsInMessages, reparentToLastUser, appendAndSortFallback helpers. complexity_introduced 29 -> 28.","timestamp":1783867166693,"segment":0,"confidence":4.0625,"asi":{"hypothesis":"Extracting sibling check, parent lookup, reparent, and sort into named helpers drops parent cyc from 10 to 6 and shifts a loadChats arrow out of introduced range (-1 net)."}}
{"run":53,"commit":"3b17a1c","metric":27,"metrics":{"fallow_health_score":77.6,"dead_code":0,"dupes":13,"tests_pass":1,"lint_pass":1,"typecheck_pass":1,"dead_code_introduced":0,"duplication_introduced":6},"status":"keep","description":"Decomposed postTestEmail (was cyc=6, crap=42) in public/js/features/admin/settings/security-shared.js. Extracted throwTestEmailError helper. complexity_introduced 28 -> 27.","timestamp":1783867475574,"segment":0,"confidence":4.125,"asi":{"hypothesis":"Extracting error response parsing from postTestEmail drops cyc below threshold."}}
{"run":54,"commit":"3b17a1c","metric":27,"metrics":{"fallow_health_score":77.6,"dead_code":0,"dupes":13,"tests_pass":1,"lint_pass":1,"typecheck_pass":1,"dead_code_introduced":0,"duplication_introduced":6},"status":"discard","description":"Decomposed handleAdminToolServersOAuth (was cyc=49) into resolveClientId + extractOAuthStartFields + buildOAuthState + handleOAuthCallback helpers. complexity_introduced 27 -> 27 (no change — main handler still cyc=29 > 20). All gates green.","timestamp":1783921374153,"segment":0,"confidence":4,"asi":{"hypothesis":"Decomposing a 49-cyc router into 5 smaller helpers (each below cyc=7) should reduce complexity_introduced by ~1 per helper. But handleAdminToolServersOAuth still has cyc=29 (many if/|| chains) — the extractField/||-based checks remain.","next_hint":"Focus on the if (!clientId && registrationEndpoint) block — it has ~8 conditional branches. Move the registration logic to a separate function that returns 502/400 directly instead of inline return error(). This would reduce the parent's cyc from ~29 to ~21, still above 20.","rollback_reason":"complexity_introduced did not improve — 27 unchanged. The main handler still has cyc=29 from the combined if/||/ternary checks in the POST start bodyT start body.\"}"}}
{"run":55,"commit":"3b17a1c","metric":25,"metrics":{"fallow_health_score":77.6,"dead_code":0,"dupes":13,"tests_pass":1,"lint_pass":1,"typecheck_pass":1,"dead_code_introduced":0,"duplication_introduced":6},"status":"keep","description":"Decomposed extractSseDelta (was cyc=6, crap=42) in public/js/shared/utils.js. Extracted isSseTerminator and parseSsePayload helpers. complexity_introduced 27 -> 25 (-2). Tests, lint, typecheck pass.","timestamp":1783922655050,"segment":0,"confidence":4,"asi":{"hypothesis":"Splitting the terminator check and JSON parsing out of extractSseDelta lowers the parent's cyclomatic complexity below the CRAP threshold (cyc <=4 -> CRAP <=20 at 0% coverage). The new helpers are tiny (cyc <=2) and also stay below threshold.","next_hint":"Continue decomposing other cyc=5/6 introduced functions in changed files, e.g. src/admin/tool-servers.js testToolServerConnection, public/js/bootstrap/auth-reset.js validateResetPassword, or public/js/features/admin/audit-logs.js loadLogs."}}
{"run":56,"commit":"50f6d2c","metric":24,"metrics":{"fallow_health_score":77.6,"dead_code":0,"dupes":13,"tests_pass":1,"lint_pass":1,"typecheck_pass":1,"dead_code_introduced":0,"duplication_introduced":6},"status":"keep","description":"Decomposed testToolServerConnection (was cyc=5, crap=30) in src/admin/tool-servers.js. Extracted resolveToolServerUrl helper. complexity_introduced 25 -> 24 (-1). Tests, lint, typecheck pass.","timestamp":1783922935211,"segment":0,"confidence":4.0588235294117645,"asi":{"hypothesis":"Extracting the URL validation into a tiny helper drops the parent's cyclomatic complexity below the CRAP threshold (cyc <=4). Helper cyc=3 stays below threshold.","next_hint":"Continue with cyc=5/6 introduced functions: public/js/bootstrap/auth-reset.js validateResetPassword/handleResetPasswordSubmit, public/js/features/admin/audit-logs.js loadLogs, or public/js/features/chat/chat-data-controller.js resolveFallbackMessageInsertion."}}
{"run":57,"commit":"efca9ab","metric":22,"metrics":{"fallow_health_score":77.6,"dead_code":0,"dupes":13,"tests_pass":1,"lint_pass":1,"typecheck_pass":1,"dead_code_introduced":0,"duplication_introduced":6},"status":"keep","description":"Decomposed validateResetPassword (was cyc=5, crap=30) in public/js/bootstrap/auth-reset.js. Extracted isResetPasswordMissing and isResetPasswordTooShort helpers. complexity_introduced 24 -> 22 (-2). Tests, lint, typecheck pass.","timestamp":1783923263495,"segment":0,"confidence":4.176470588235294,"asi":{"hypothesis":"Moving the boolean validation expressions into named helpers drops the parent's cyclomatic complexity from cyc=5 to cyc=3, removing the CRAP finding. Helpers are cyc=2 each.","next_hint":"Decompose handleResetPasswordSubmit next (same file) by extracting submitResetPassword and gatherResetFormInputs helpers."}}
