{"run":84,"commit":"0000000","metric":1,"metrics":{"fallow_health_score":77.6,"dead_code":0,"dupes":6,"tests_pass":1,"lint_pass":1,"typecheck_pass":1,"dead_code_introduced":0,"duplication_introduced":0},"status":"discard","description":"Extracted loadExistingUserConnection helper in src/llm/connections-user.js to remove a same-file duplicate. dupes_total dropped 7 -> 6, but modifying the file caused existing cyc>20 functions in it to count as introduced, regressing complexity_introduced 0 -> 1 and changing audit verdict to fail. Reverting.","timestamp":1783934389166,"segment":0,"confidence":4.088888888888889,"asi":{"hypothesis":"Extracting a shared helper for the repeated validation/table-check/existing lookup in connections-user.js would remove a clone group.","rollback_reason":"Touching src/llm/connections-user.js surfaces its existing high-cyclomatic functions into complexity_introduced, regressing the primary metric.","next_action_hint":"Avoid same-file dedup in files that already contain cyc>20 functions. Prefer cross-file or helper extraction in files with no high-cyclomatic functions, or extract to a new file instead of modifying the high-cyclomatic file."}}
{"run":85,"commit":"3eeb849","metric":0,"metrics":{"fallow_health_score":77.6,"dead_code":0,"dupes":6,"tests_pass":1,"lint_pass":1,"typecheck_pass":1,"dead_code_introduced":0,"duplication_introduced":0},"status":"keep","description":"Share parseJsonObjectOrDefault helper in src/utils/json.js and reuse in user-profile.js (remove local parseJsonObject) and users-helpers.js (replace parseSettings). Dupes_total 7 -> 6. complexity_introduced remains 0, audit_verdict pass. Tests, lint, typecheck pass. Safe file selection: none of the modified files have cyc>20 functions.","timestamp":1783935010348,"segment":0,"confidence":4.088888888888889,"asi":{"hypothesis":"Adding parseJsonObjectOrDefault to utils/json.js and replacing the local parseJsonObject in user-profile.js (which was the duplicate) and parseSettings in users-helpers.js reduces an introduced clone group. The helper is used as a default-returning variant where parseJsonObject was needed.","next_hint":"dupes_total=6 remains remains. }"}}
{"run":86,"commit":"30444e6","metric":0,"metrics":{"fallow_health_score":77.6,"dead_code":0,"dupes":5,"tests_pass":1,"lint_pass":1,"typecheck_pass":1,"dead_code_introduced":0,"duplication_introduced":0},"status":"keep","description":"Extract buildInitialRoleDraft helper in public/js/features/admin/users/roles-modal.js to remove same-file duplicate between initial open and reset handler. dupes_total 6 -> 5. complexity_introduced remains 0, audit_verdict pass. Tests, lint, typecheck pass.","timestamp":1783935669784,"segment":0,"confidence":4.088888888888889,"asi":{"hypothesis":"Extracting the repeated createRoleDraft ternary in roles-modal.js into a helper removes the same-file clone group without touching any file with cyc>20 functions.","next_hint":"dupes_total=5 remains. Remaining safe targets include models-render/models-sync-ui skeleton duplication and model-state count duplication. Avoid chat-core.js and connections-user.js due to cyc>20 functions."}}
{"run":87,"commit":"1ebb53f","metric":0,"metrics":{"fallow_health_score":77.6,"dead_code":0,"dupes":4,"tests_pass":1,"lint_pass":1,"typecheck_pass":1,"dead_code_introduced":0,"duplication_introduced":0},"status":"keep","description":"Extract renderModelRowsHtml helper into models-display-shared.js and reuse in models-render.js and models-sync-ui.js. Removed 20-line duplicate model rows HTML generation between both files. dupes_total 5 -> 4. complexity_introduced remains 0, audit_verdict pass. Tests, lint, typecheck pass.","timestamp":1783936229266,"segment":0,"confidence":4.088888888888889,"asi":{"hypothesis":"Extracting the shared model rows HTML generation into models-display-shared.js removes the largest remaining clone group (20 lines). Both callers use the same helper with consistent params.","next_hint":"dupes_total=4 remains. Remaining safe targets: model-state cross-file (countEnabledModels). Avoid chat-core.js, connections-user.js due to cyc>20 functions."}}
{"run":88,"commit":"fce9623","metric":0,"metrics":{"fallow_health_score":77.6,"dead_code":0,"dupes":3,"tests_pass":1,"lint_pass":1,"typecheck_pass":1,"dead_code_introduced":0,"duplication_introduced":0},"status":"keep","description":"Extract validateTrimmedModelId helper in src/routers/chat-core.js to deduplicate the same-file model ID validation pattern between getUserDefaultModelId and getGlobalDefaultModelId. Both functions validated model IDs using identical tri-state check (empty, >200 chars, whitespace-only). The new helper (cyc=3) is the natural building block for model ID validation. dupes_total: 4 -> 3, complexity_introduced remains 0. All gates green.","timestamp":1783938437983,"segment":0,"confidence":4.088888888888889,"asi":{"hypothesis":"Extracting the shared validation pattern (validate-trim-check-return) from the same-file duplicate in chat-core.js removes the clone group without affecting any file with cyc>20 functions. The helper is tiny (cyc=3) and the parent functions drop from cyc=7-8 to cyc=3-4 each.","rollback_reason":"Not needed — no regression on primary metric.","next_action_hint":"The remaining 3 dupes are the assistant-runner.js ↔ chat.js import block (25 lines, inherited). That block can't be extracted without touching files with cyc>20 functions (assistant-runner.js has many). Consider whether the dupes_total=3 metric can be improved without regressing complexity_introduced."}}
{"type":"config","name":"Reduce dupes to 0","metricName":"dupes","metricUnit":"","bestDirection":"lower"}
{"run":89,"commit":"fce9623","metric":3,"metrics":{"fallow_health_score":77.6,"complexity_introduced":0,"dead_code":0,"tests_pass":1,"lint_pass":1,"typecheck_pass":1,"dead_code_introduced":0,"duplication_introduced":0},"status":"keep","description":"Baseline for new experiment: reduce dupes to 0. Current state after complexity_introduced phase: dupes_total=3, complexity_introduced=0, audit_verdict=pass, all gates green. Remaining duplication is the assistant-runner.js ↔ chat.js dependency contract (25 lines, 2 instances).","timestamp":1783939353322,"segment":1,"confidence":null,"asi":{"hypothesis":"New phase: target dupes_total. Baseline confirms only one clone family remains, inherited from pre-existing code. No introduced complexity or duplication. Health score at config ceiling.","next_action_hint":"Extract the shared assistant-runner dependency contract into a default deps module (assistant-runner-deps.js). Merge defaults with caller-provided deps in createAssistantRunner. Remove the 25-line object literal from chat.js and the publishRealtimeNow local definition."}}
{"run":90,"commit":"e47c025","metric":3,"metrics":{"fallow_health_score":77.6,"complexity_introduced":0,"dead_code":0,"tests_pass":1,"lint_pass":0,"typecheck_pass":1,"dead_code_introduced":0,"duplication_introduced":1},"status":"discard","description":"Attempted to extract assistant-runner deps into src/chat/assistant-runner-deps.js barrel module. The new module created boundary warnings (s-chat importing s-llm and s-router) which caused measure.sh lint grep to detect 'error' in output → lint_pass=0. It also relocated the 25-line dependency list, creating a new introduced clone between assistant-runner-deps.js and assistant-runner.js → duplication_introduced=1. dupes remained 3. Reverted.","timestamp":1783940050684,"segment":1,"confidence":null,"asi":{"hypothesis":"Centralizing assistant-runner deps in a shared barrel module would remove the 25-line duplicate between assistant-runner.js and chat.js.","rollback_reason":"Barrel file in s-chat layer violates boundary rules by importing s-llm and s-router, producing lint warnings. measure.sh's 'error' grep treats warnings output as failure. New file also creates introduced duplication with assistant-runner.js destructuring.","next_action_hint":"Try the opposite geometry: keep chat.js as the assembler (s-router can import s-chat and s-llm) and restructure assistant-runner.js to access deps via direct property access, eliminating the matching destructuring block. Or accept that dupes=3 is the natural floor for this DI contract."}}
{"run":91,"commit":"e47c025","metric":2,"metrics":{"fallow_health_score":77.6,"complexity_introduced":0,"dead_code":0,"tests_pass":1,"lint_pass":1,"typecheck_pass":1,"dead_code_introduced":0,"duplication_introduced":0},"status":"keep","description":"Restructured assistant-runner.js to access injected deps via direct property access (deps.xxx) instead of destructuring. This eliminates the 25-line destructuring block that formed a clone with the dependency object literal in chat.js. dupes dropped 3 -> 2, complexity_introduced remains 0, duplication_introduced remains 0, lint/typecheck/tests all green.","timestamp":1783940702372,"segment":1,"confidence":null,"asi":{"hypothesis":"Accessing injected dependencies via deps.xxx in assistant-runner.js removes the matching destructuring block without creating cross-layer imports or new files, avoiding boundary violations and introduced duplication.","next_action_hint":"Remaining dupes=2 come from two inherited clone groups: model-state.js cross-file and connections-user.js same-file. These are in files with cyc>20 functions, so touching them risks regressing complexity_introduced. Verify whether safe extraction is possible in a low-cyclomatic helper, or accept dupes=2 as the new floor.","rollback_reason":null}}
{"run":92,"commit":"1d55e55","metric":1,"metrics":{"fallow_health_score":77.6,"complexity_introduced":1,"dead_code":0,"tests_pass":1,"lint_pass":1,"typecheck_pass":1,"dead_code_introduced":0,"duplication_introduced":0},"status":"discard","description":"Extracted ensureUserConnectionContext helper in src/llm/connections-user.js to remove the same-file validation duplicate between updateUserOpenAIConnection and deleteUserOpenAIConnection. dupes dropped 2 -> 1, but touching the file surfaced an existing high-cyclomatic function into complexity_introduced (0 -> 1), failing the audit verdict.","timestamp":1783941090571,"segment":1,"confidence":2,"asi":{"hypothesis":"Extracting the shared validation/table-ensure block in connections-user.js into a small helper would remove the same-file clone without adding new complexity.","rollback_reason":"Touching connections-user.js caused an existing function in the file to be counted as complexity_introduced=1, regressing the primary quality gate and changing audit_verdict from pass to fail. The helper itself is safe, but the file contains other functions that exceed the audit threshold when the file is changed.","next_action_hint":"The remaining dupes=1 target is the cross-environment countEnabledModels clone between public/js/shared/utils/model-state.js and src/llm/model-state.js. Sharing it across browser/server boundaries is architecturally undesirable and likely triggers boundary lint warnings. Accepting dupes=1 is the safer floor."}}
{"run":93,"commit":"e47c025","metric":1,"metrics":{"fallow_health_score":77.6,"complexity_introduced":0,"dead_code":0,"tests_pass":1,"lint_pass":1,"typecheck_pass":1,"dead_code_introduced":0,"duplication_introduced":0},"status":"keep","description":"Re-exported countEnabledModels from public/js/shared/utils/model-state.js in src/llm/model-state.js instead of duplicating the function. This removes the cross-environment clone group between the two model-state files. dupes dropped 2 -> 1, complexity_introduced remains 0, duplication_introduced remains 0, audit_verdict pass, all gates green.","timestamp":1783941472821,"segment":1,"confidence":2,"asi":{"hypothesis":"The codebase already allows s-llm to import from f-shared (e.g., connections-user.js imports from public/js/shared/utils). Re-exporting countEnabledModels from the public/shared implementation eliminates the cross-file duplicate without boundary violations.","next_action_hint":"Only one clone group remains: the same-file validation block in src/llm/connections-user.js. Previous attempt (#92) regressed complexity_introduced to 1. To reach dupes=0, we would need to find a way to deduplicate that block without editing connections-user.js, or accept that the file's existing high-cyclomatic functions make it a hard floor.","rollback_reason":null}}
{"run":94,"commit":"e47c025","metric":0,"metrics":{"fallow_health_score":77.6,"complexity_introduced":0,"dead_code":0,"tests_pass":1,"lint_pass":1,"typecheck_pass":1,"dead_code_introduced":0,"duplication_introduced":0},"status":"keep","description":"Removed the final duplication in src/llm/connections-user.js by extracting ensureUserConnectionContext helper shared by updateUserOpenAIConnection and deleteUserOpenAIConnection. To prevent the edit from surfacing normalizeUserConnectionRow as complexity_introduced, decomposed it into resolveProviderType, resolveProviderFamily, resolveEnabled, and resolveOwnerUserId helpers, dropping its cyclomatic complexity below the threshold. dupes reached 0, complexity_introduced stays 0, audit_verdict pass, all gates green.","timestamp":1783941855745,"segment":1,"confidence":2,"asi":{"hypothesis":"The connections-user.js duplicate can be removed if we simultaneously refactor the existing high-cyclomatic function (normalizeUserConnectionRow) that gets surfaced when the file is touched, keeping net complexity_introduced at 0.","next_action_hint":"Goal achieved: dupes=0 with all gates green. The autoresearch loop for this metric can be stopped.","rollback_reason":null}}
{"type":"config","name":"Reduce functions_above_threshold from 133 to 0","metricName":"functions_above_threshold","metricUnit":"","bestDirection":"lower"}
{"run":95,"commit":"e47c025","metric":133,"metrics":{"fallow_health_score":77.6,"complexity_introduced":0,"dead_code":0,"dupes":0,"tests_pass":1,"lint_pass":1,"typecheck_pass":1},"status":"keep","description":"Baseline: functions_above_threshold=133, health_score=77.6. All quality gates green. New target: reduce 133→0.","timestamp":1783943465315,"segment":2,"confidence":null}
{"run":96,"commit":"e47c025","metric":132,"metrics":{"fallow_health_score":77.6,"complexity_introduced":0,"dead_code":0,"dupes":0,"tests_pass":1,"lint_pass":1,"typecheck_pass":1},"status":"keep","description":"Extracted screen-capture helpers in message-input-ui.js to shrink captureScreen below the 60-LOC threshold. functions_above_threshold 133 -> 132. complexity_introduced remains 0; all gates green.","timestamp":1783944108512,"segment":2,"confidence":null,"asi":{"hypothesis":"Shrinking the smallest above-threshold function (captureScreen, 62 LOC) by extracting module-level helpers will reduce functions_above_threshold by 1 without introducing complexity or dead code.","files_changed":["public/js/features/chat/message-input-ui.js"],"measure_sh_updated":true,"next":"Target the next closest unit_size functions: setResourceVisibility (63 LOC), connect (64 LOC), handleFilesSelected (65 LOC), readStreamChunkWithHeartbeat (65 LOC), buildSelfProfileUpdate (66 LOC), buildAttachmentParts (68 LOC)."}}
{"run":97,"commit":"e47c025","metric":130,"metrics":{"fallow_health_score":77.6,"complexity_introduced":0,"dead_code":0,"dupes":0,"tests_pass":1,"lint_pass":1,"typecheck_pass":1},"status":"keep","description":"Extracted helpers in user-resource-overrides.js to shrink setResourceVisibility below 60 LOC. functions_above_threshold 132 -> 130. complexity_introduced remains 0; all gates green.","timestamp":1783944433702,"segment":2,"confidence":3,"asi":{"hypothesis":"Shrinking setResourceVisibility by extracting cloneSubObject, applyHiddenIdsToOverrides, and applyModelVisibility helpers drops its LOC below 60 without adding new threshold-violating functions.","files_changed":["public/js/shared/utils/user-resource-overrides.js"],"next":"Target connect (64 LOC) in public/js/shared/realtime.js next."}}
{"run":98,"commit":"e47c025","metric":124,"metrics":{"fallow_health_score":77.6,"complexity_introduced":0,"dead_code":0,"dupes":0,"tests_pass":1,"lint_pass":1,"typecheck_pass":1},"status":"keep","description":"Refactored realtime.js: split connect into runConnectLoop + helpers, decomposed isDuplicateEvent/flushEvent/logConnectError, and added stringField to drop buildEventKey CRAP. functions_above_threshold 130 -> 124, complexity_introduced back to 0, audit verdict pass.","timestamp":1783945477843,"segment":2,"confidence":6,"asi":{"hypothesis":"Comprehensive decomposition of realtime.js removes the connect unit_size finding and the associated CRAP/complexity findings in the same changed file, keeping complexity_introduced at 0.","files_changed":["public/js/shared/realtime.js"],"next":"Target handleFilesSelected (65 LOC) in public/js/features/chat/chat-file-events.js or readStreamChunkWithHeartbeat (65 LOC) in src/chat/assistant-stream-utils.js."}}
{"run":99,"commit":"e47c025","metric":123,"metrics":{"fallow_health_score":77.6,"complexity_introduced":0,"dead_code":0,"dupes":0,"tests_pass":1,"lint_pass":1,"typecheck_pass":1},"status":"keep","description":"Refactored chat-file-events.js: extracted processSelectedFile, showUploadError, showUploadSkipMessages, mergeUploadedAttachments, resolveAttachmentMediaType, isModelAttachmentAllowed, showAttachSkipMessages, and mergeAttachFiles helpers. handleFilesSelected dropped below 60 LOC and handleAttachFiles complexity introduced was eliminated. functions_above_threshold 124 -> 123, complexity_introduced 0, audit verdict pass.","timestamp":1783946243453,"segment":2,"confidence":3.3333333333333335,"asi":{"hypothesis":"Extracting upload/attachment helpers from handleFilesSelected and handleAttachFiles reduces the large function count while keeping all new helpers below CRAP thresholds.","files_changed":["public/js/features/chat/chat-file-events.js"],"next":"Target readStreamChunkWithHeartbeat (65 LOC, cyc=15) in src/chat/assistant-stream-utils.js or buildSelfProfileUpdate (66 LOC) in src/routers/user-profile.js."}}
{"run":100,"commit":"e47c025","metric":122,"metrics":{"fallow_health_score":77.6,"complexity_introduced":0,"dead_code":0,"dupes":0,"tests_pass":1,"lint_pass":1,"typecheck_pass":1},"status":"keep","description":"Refactored readStreamChunkWithHeartbeat in src/chat/assistant-stream-utils.js. Extracted cancelReaderSilently, resolveEffectiveTimeoutMs, startHeartbeat, and createTimeoutRace helpers. Reduced the function below 60 LOC while preserving timeout/heartbeat behavior. functions_above_threshold 123 -> 122, complexity_introduced 0, audit verdict pass.","timestamp":1783946556977,"segment":2,"confidence":2.4444444444444446,"asi":{"hypothesis":"Splitting the stream timeout/heartbeat setup into focused helpers removes the >60 LOC finding without changing semantics.","files_changed":["src/chat/assistant-stream-utils.js"],"next":"Target buildSelfProfileUpdate (66 LOC, cyc=15) in src/routers/user-profile.js."}}
{"run":101,"commit":"e47c025","metric":121,"metrics":{"fallow_health_score":77.6,"complexity_introduced":0,"dead_code":0,"dupes":0,"tests_pass":1,"lint_pass":1,"typecheck_pass":1},"status":"keep","description":"Refactored buildSelfProfileUpdate in src/routers/user-profile.js. Extracted parseProfileName, parseAvatarEmoji, parseProfileStatus, stringifyPlainObject helpers and a pushField closure. Reduced the function below 60 LOC. functions_above_threshold 122 -> 121, complexity_introduced 0, audit verdict pass.","timestamp":1783946829753,"segment":2,"confidence":4,"asi":{"hypothesis":"Moving per-field validation into named helpers and using a pushField closure shrinks the main builder below the 60-LOC threshold without adding complexity.","files_changed":["src/routers/user-profile.js"],"next":"Target buildAttachmentParts (68 LOC, cyc=24) in src/routers/chat-core.js. Need to decompose carefully because cyc>20 in changed file risks complexity_introduced."}}
{"run":102,"commit":"e47c025","metric":120,"metrics":{"fallow_health_score":77.6,"complexity_introduced":0,"dead_code":0,"dupes":0,"tests_pass":1,"lint_pass":1,"typecheck_pass":1},"status":"keep","description":"Refactored buildAttachmentParts in src/routers/chat-core.js. Extracted assertSupportedAttachmentType, assertAttachmentSize, assertTotalAttachmentSize, buildTextAttachmentPart, and buildAttachmentPart helpers. Main function dropped below 60 LOC and helper decomposition kept cyclomatic complexity below threshold. functions_above_threshold 121 -> 120, complexity_introduced 0, audit verdict pass.","timestamp":1783947145230,"segment":2,"confidence":4.333333333333333,"asi":{"hypothesis":"Extracting validation and part-building helpers from buildAttachmentParts removes the >60 LOC finding while keeping each helper small enough to avoid introduced complexity.","files_changed":["src/routers/chat-core.js"],"next":"Target renderAccessInspectorContent (70 LOC, cyc=26) in public/js/features/admin/users/overview-render.js."}}
{"run":103,"commit":"e47c025","metric":119,"metrics":{"fallow_health_score":77.6,"complexity_introduced":0,"dead_code":0,"dupes":0,"tests_pass":1,"lint_pass":1,"typecheck_pass":1},"status":"keep","description":"Refactored renderAccessInspectorContent in public/js/features/admin/users/overview-render.js. Extracted countDisabledRules, resolveAccessFamilies, buildAccessInspectorHeader, buildGroupsSection, buildRolePermissionsSection, and buildResourceFamilySections helpers. Main function dropped below 60 LOC and cyclomatic complexity stayed below threshold. functions_above_threshold 120 -> 119, complexity_introduced 0, audit verdict pass.","timestamp":1783947464553,"segment":2,"confidence":4.666666666666667,"asi":{"hypothesis":"Splitting a large template renderer into section helpers removes the unit-size finding without changing rendered output.","files_changed":["public/js/features/admin/users/overview-render.js"],"next":"Target updateMessageContentDom (73 LOC, cyc=27) in public/js/features/chat/chat-message-dom.js."}}
