{"run":175,"commit":"f406adf","metric":143,"metrics":{"fallow_health_score":77.6,"complexity_introduced":30,"dead_code":0,"dupes":0,"tests_pass":0,"lint_pass":1,"typecheck_pass":1},"status":"keep","description":"refactor(admin): decompose buildBulkServerAclStatements","timestamp":1784024147988,"segment":3,"confidence":4,"asi":{"hypothesis":"buildBulkServerAclStatements mixed id normalization, server lookup, editability check, rule validation, and statement building in one loop. Extracting resolveToolServerId, requireEditableServer, and validateServerRules removes the CRAP finding and reduces complexity_introduced.","files_changed":["src/routers/admin/admin-tool-servers-access.js"]}}
{"run":176,"commit":"f406adf","metric":142,"metrics":{"fallow_health_score":77.6,"complexity_introduced":30,"dead_code":0,"dupes":0,"tests_pass":0,"lint_pass":1,"typecheck_pass":1},"status":"keep","description":"refactor(account): decompose model list event handlers","timestamp":1784024454494,"segment":3,"confidence":4.066666666666666,"asi":{"hypothesis":"The click handler in account-models-events mixed search clear, pagination, and model toggle logic with state snapshots. Extracting handleModelSearchInput, clearModelSearch, prevModelPage, nextModelPage, snapshotModelToggleState, applyModelToggle, handleModelToggle, dispatchModelClick, and handleProviderChange removes the CRAP finding.","files_changed":["public/js/features/account/account-models-events.js"]}}
{"run":177,"commit":"f406adf","metric":141,"metrics":{"fallow_health_score":77.6,"complexity_introduced":29,"dead_code":0,"dupes":0,"tests_pass":0,"lint_pass":1,"typecheck_pass":1},"status":"keep","description":"refactor(oauth): simplify resolveClientCredentials","timestamp":1784024735745,"segment":3,"confidence":4.133333333333334,"asi":{"hypothesis":"resolveClientCredentials used explicit fallback chains for client id and secret, creating a high-cyclomatic finding. Extracting resolveOAuthString with dynamic key lookup removes the CRAP finding and reduces complexity_introduced.","files_changed":["src/routers/users/mcp-oauth.js"]}}
{"run":178,"commit":"f406adf","metric":140,"metrics":{"fallow_health_score":77.6,"complexity_introduced":29,"dead_code":0,"dupes":0,"tests_pass":0,"lint_pass":1,"typecheck_pass":1},"status":"keep","description":"refactor(chat): decompose remapSelectionMaps","timestamp":1784025005937,"segment":3,"confidence":4.064516129032258,"asi":{"hypothesis":"remapSelectionMaps combined current-leaf, streaming-override, and branch-selection remapping. Extracting remapCurrentLeaf, remapStreamingOverride, and remapBranchSelection removes the CRAP finding.","files_changed":["public/js/features/chat/chat-message-identity.js"]}}
{"run":179,"commit":"f406adf","metric":139,"metrics":{"fallow_health_score":77.6,"complexity_introduced":29,"dead_code":0,"dupes":0,"tests_pass":0,"lint_pass":1,"typecheck_pass":1},"status":"keep","description":"refactor(chat): decompose replaceTempMessageId","timestamp":1784025296937,"segment":3,"confidence":4,"asi":{"hypothesis":"replaceTempMessageId combined state message replacement, editing map updates, DOM attribute updates, and resolver callbacks. Extracting replaceMessageIdInMsg, buildReplacementMessages, updateEditingMap, updateMessageAttributes, and runTempResolvers removes the CRAP finding.","files_changed":["public/js/features/chat/chat-message-identity.js"]}}
{"run":180,"commit":"f406adf","metric":137,"metrics":{"fallow_health_score":77.6,"complexity_introduced":29,"dead_code":0,"dupes":0,"tests_pass":0,"lint_pass":1,"typecheck_pass":1},"status":"keep","description":"refactor(chat): decompose matchPendingTempMessage","timestamp":1784025743660,"segment":3,"confidence":4.125,"asi":{"hypothesis":"matchPendingTempMessage combined fingerprint extraction, role/parent/content filtering, and best-index selection. Extracting buildMessageFingerprint, roleAllowsEmptyMatch, contentMatches, candidateMatches, findBestCandidateIndex, and applyMatchedTempMessage removes the CRAP finding.","files_changed":["public/js/features/chat/chat-message-identity.js"]}}
{"run":181,"commit":"bc28e39","metric":136,"metrics":{"fallow_health_score":77.6,"complexity_introduced":29,"dead_code":0,"dupes":0,"tests_pass":0,"lint_pass":1,"typecheck_pass":1},"status":"keep","description":"refactor(admin): decompose save-modal handler in integrations","timestamp":1784030880670,"segment":3,"confidence":4.1875,"asi":{"hypothesis":"The save-modal click handler mixed server field reading, payload building, update/insert decision, and verify-after-save into one complex arrow. Extracting readServerFormFields, buildServerPayload, upsertServer, applyServerVerifyResult, and verifyServerAfterSave removes the CRAP finding.","files_changed":["public/js/features/admin/settings/integrations-event-handlers.js"]}}
{"run":182,"commit":"cdd7503","metric":135,"metrics":{"fallow_health_score":77.6,"complexity_introduced":28,"dead_code":0,"dupes":0,"tests_pass":0,"lint_pass":1,"typecheck_pass":1},"status":"keep","description":"refactor(account): compact optional payload fields in integrations modal","timestamp":1784031455736,"segment":3,"confidence":4.121212121212121,"asi":{"hypothesis":"buildPayload had nine sequential `if (!payload.x) delete payload.x` branches. Replacing them with a field list and a compactOptionalFields helper removes the CRAP finding and reduces cyclomatic complexity.","files_changed":["public/js/features/account/account-integrations-modal.js"]}}
{"run":183,"commit":"cdd7503","metric":134,"metrics":{"fallow_health_score":77.6,"complexity_introduced":28,"dead_code":0,"dupes":0,"tests_pass":0,"lint_pass":1,"typecheck_pass":1},"status":"keep","description":"refactor(shared): replace provider-name fallback chain with field list scan","timestamp":1784031760653,"segment":3,"confidence":4.0588235294117645,"asi":{"hypothesis":"getRawProviderName used ten optional-chain/OR branches to pick the first present provider field. Iterating over a PROVIDER_NAME_FIELDS list removes the high-cyclomatic finding while preserving fallback order.","files_changed":["public/js/shared/utils/model-filters.js"]}}
{"run":184,"commit":"bef2e00","metric":133,"metrics":{"fallow_health_score":77.6,"complexity_introduced":27,"dead_code":0,"dupes":0,"tests_pass":0,"lint_pass":1,"typecheck_pass":1},"status":"keep","description":"refactor(models): extract connection field helpers in normalizeConnectionForCache","timestamp":1784032095568,"segment":3,"confidence":4.117647058823529,"asi":{"hypothesis":"normalizeConnectionForCache had nine optional-chain `conn?.x || ''` conversions. Extracting getConnectionString and getConnectionStringFallback removes the high-cyclomatic finding and reduces complexity_introduced.","files_changed":["src/routers/models/models-helpers.js"]}}
{"run":185,"commit":"5d02e58","metric":132,"metrics":{"fallow_health_score":77.6,"complexity_introduced":27,"dead_code":0,"dupes":0,"tests_pass":0,"lint_pass":1,"typecheck_pass":1},"status":"keep","description":"refactor(admin): extract connection list item normalizer","timestamp":1784032447347,"segment":3,"confidence":4.176470588235294,"asi":{"hypothesis":"parseConnectionsList contained a map arrow with multiple optional-chain conversions and a key-mask ternary. Extracting normalizeConnectionListItem and small field helpers removes the arrow CRAP finding.","files_changed":["src/routers/admin/admin-connections-list.js"]}}
{"run":186,"commit":"5d02e58","metric":131,"metrics":{"fallow_health_score":77.6,"complexity_introduced":27,"dead_code":0,"dupes":0,"tests_pass":0,"lint_pass":1,"typecheck_pass":1},"status":"keep","description":"refactor(account): decompose OAuth connect handler in integrations modal","timestamp":1784032771002,"segment":3,"confidence":4.114285714285714,"asi":{"hypothesis":"The OAuth connect click handler mixed guard checks, payload construction, response handling, and success UI. Extracting canStartOAuthConnection, requireServerIdForOAuth, buildOAuthStartPayload, and handleOAuthStartSuccess removes the arrow CRAP finding.","files_changed":["public/js/features/account/account-integrations-modal.js"]}}
{"run":187,"commit":"5d02e58","metric":130,"metrics":{"fallow_health_score":77.6,"complexity_introduced":27,"dead_code":0,"dupes":0,"tests_pass":0,"lint_pass":1,"typecheck_pass":1},"status":"keep","description":"refactor(realtime): simplify normalizeRealtimeEvent with pick helpers","timestamp":1784033071016,"segment":3,"confidence":4.055555555555555,"asi":{"hypothesis":"normalizeRealtimeEvent had many optional-chain/fallback conversions and nested ternaries. Extracting pickTruthyString, pickTrimmedString, pickOptionalString, and coerceDataValue removes the CRAP finding while preserving field-fallback behavior.","files_changed":["src/features/realtime/realtime.js"]}}
{"run":188,"commit":"5d02e58","metric":129,"metrics":{"fallow_health_score":77.6,"complexity_introduced":27,"dead_code":0,"dupes":0,"tests_pass":0,"lint_pass":1,"typecheck_pass":1},"status":"keep","description":"refactor(shared): simplify filterModelsBySearch filter arrow","timestamp":1784033359645,"segment":3,"confidence":4.111111111111111,"asi":{"hypothesis":"The filter callback in filterModelsBySearch had multiple optional-chain conversions. Extracting firstPresentValue and getModelSearchFieldValues lets the arrow become a one-line some() call, removing the CRAP finding.","files_changed":["public/js/shared/utils/model-search.js"]}}
{"run":189,"commit":"5d02e58","metric":128,"metrics":{"fallow_health_score":77.6,"complexity_introduced":27,"dead_code":0,"dupes":0,"tests_pass":0,"lint_pass":1,"typecheck_pass":1},"status":"keep","description":"refactor(chat): decompose applyToolCallDelta foreach arrow","timestamp":1784033654582,"segment":3,"confidence":3.9473684210526314,"asi":{"hypothesis":"The forEach arrow in applyToolCallDelta mixed index guards, id/function updates, and providerMetadata merging. Extracting applySingleToolCallDelta, ensureToolCallSlot, applyToolCallFunction, and mergeProviderMetadata removes the arrow CRAP finding.","files_changed":["src/chat/tools.js"]}}
{"run":190,"commit":"5d02e58","metric":127,"metrics":{"fallow_health_score":77.6,"complexity_introduced":27,"dead_code":0,"dupes":0,"tests_pass":0,"lint_pass":1,"typecheck_pass":1},"status":"keep","description":"refactor(chat): decompose buildFallbackAssistantMessage","timestamp":1784033947898,"segment":3,"confidence":4,"asi":{"hypothesis":"buildFallbackAssistantMessage combined guard, existing-message lookup, content resolution with nullish coalescing, and two branch-heavy return objects. Extracting resolveExistingMessage, resolveFallbackContent, buildExistingFallback, and buildNewFallback removes the CRAP finding.","files_changed":["public/js/features/chat/chat-wire-controllers.js"]}}
{"run":191,"commit":"5d02e58","metric":126,"metrics":{"fallow_health_score":77.6,"complexity_introduced":27,"dead_code":0,"dupes":0,"tests_pass":0,"lint_pass":1,"typecheck_pass":1},"status":"keep","description":"refactor(shared): replace graphviz global fallback chain with path scan","timestamp":1784034230014,"segment":3,"confidence":4.052631578947368,"asi":{"hypothesis":"getGlobalGraphviz used eight optional-chain/OR branches to locate the Graphviz global. Iterating over a GRAPHVIZ_PATHS list with a nested key walk removes the high-cyclomatic finding.","files_changed":["public/js/shared/markdown-special-block-runtime.js"]}}
{"run":192,"commit":"5d02e58","metric":125,"metrics":{"fallow_health_score":77.6,"complexity_introduced":27,"dead_code":0,"dupes":0,"tests_pass":0,"lint_pass":1,"typecheck_pass":1},"status":"keep","description":"refactor(chat): decompose buildMcpTools foreach arrows","timestamp":1784034580418,"segment":3,"confidence":4.105263157894737,"asi":{"hypothesis":"buildMcpTools used nested forEach arrows with multiple guard returns and optional-chain field reads. Extracting processMcpServer, processMcpTool, buildMcpToolFunction, and firstPresentValue removes the arrow CRAP findings.","files_changed":["src/chat/mcp.js"]}}
{"run":193,"commit":"5d02e58","metric":124,"metrics":{"fallow_health_score":77.6,"complexity_introduced":27,"dead_code":0,"dupes":0,"tests_pass":0,"lint_pass":1,"typecheck_pass":1},"status":"keep","description":"refactor(shared): replace chat-row action branches with loop","timestamp":1784034873197,"segment":3,"confidence":4.157894736842105,"asi":{"hypothesis":"The chat-row dropdown click handler used six sequential if branches for actions. Replacing them with a CHAT_ROW_ACTIONS loop and handler lookup removes the arrow CRAP finding.","files_changed":["public/js/shared/components/chat-row.js"]}}
{"run":194,"commit":"5d02e58","metric":123,"metrics":{"fallow_health_score":77.6,"complexity_introduced":27,"dead_code":0,"dupes":0,"tests_pass":0,"lint_pass":1,"typecheck_pass":1},"status":"keep","description":"refactor(services): extract tool normalization helpers","timestamp":1784035173394,"segment":3,"confidence":4.102564102564102,"asi":{"hypothesis":"normalizeTool used multiple optional-chain branches. Extracting getToolString, getToolBoolean, and getToolObject removes the CRAP finding.","files_changed":["src/services/workspace-settings.js"]}}
{"run":195,"commit":"5d02e58","metric":122,"metrics":{"fallow_health_score":77.6,"complexity_introduced":27,"dead_code":0,"dupes":0,"tests_pass":0,"lint_pass":1,"typecheck_pass":1},"status":"keep","description":"refactor(account): simplify normalizeTool with list-driven helpers","timestamp":1784035488847,"segment":3,"confidence":4.05,"asi":{"hypothesis":"normalizeTool used chained fallbacks and a nested ternary for parameters. Replacing with pickFirstPresentString and pickToolObject loops removes the CRAP finding without duplicating workspace helper patterns.","files_changed":["public/js/features/account/account-integrations-helpers.js"]}}
{"run":196,"commit":"5d02e58","metric":120,"metrics":{"fallow_health_score":77.6,"complexity_introduced":26,"dead_code":0,"dupes":0,"tests_pass":0,"lint_pass":1,"typecheck_pass":1},"status":"keep","description":"refactor(admin): extract connection test helpers","timestamp":1784035816346,"segment":3,"confidence":4.15,"asi":{"hypothesis":"buildTestConnection and formatDiscoveredModels map arrow had chained optional/fallback branches. Extracting resolveConnectionAuthType, resolveConnectionKey, resolveDisplayName, and stripModelsPrefix removes the CRAP findings.","files_changed":["src/routers/admin/admin-connections-list.js"]}}
{"run":197,"commit":"5d02e58","metric":119,"metrics":{"fallow_health_score":77.6,"complexity_introduced":25,"dead_code":0,"dupes":0,"tests_pass":0,"lint_pass":1,"typecheck_pass":1},"status":"keep","description":"refactor(account): extract connection modal field helpers","timestamp":1784036077226,"segment":3,"confidence":4.2,"asi":{"hypothesis":"buildConnectionForModal had chained fallback branches for URL, provider type, key, and has_key. Extracting getConnectionUrl, getConnectionProviderType, getConnectionKey, and hasConnectionKey removes the CRAP finding.","files_changed":["public/js/features/account/account-connections-modal.js"]}}
{"run":198,"commit":"5d02e58","metric":118,"metrics":{"fallow_health_score":77.6,"complexity_introduced":24,"dead_code":0,"dupes":0,"tests_pass":0,"lint_pass":1,"typecheck_pass":1},"status":"keep","description":"refactor(llm): extract tool choice name predicates","timestamp":1784036358638,"segment":3,"confidence":4.146341463414634,"asi":{"hypothesis":"normalizeObjectToolChoice had inline optional-chain conditions for tool/function names. Extracting hasToolName and hasFunctionName predicates removes the CRAP finding.","files_changed":["src/llm/provider-adapters-utils.js"]}}
{"run":199,"commit":"5d02e58","metric":117,"metrics":{"fallow_health_score":77.6,"complexity_introduced":23,"dead_code":0,"dupes":0,"tests_pass":0,"lint_pass":1,"typecheck_pass":1},"status":"keep","description":"refactor(llm): decompose convertSchemaObject with field helpers","timestamp":1784036656262,"segment":3,"confidence":4.095238095238095,"asi":{"hypothesis":"convertSchemaObject had a long sequence of if branches for schema fields. Extracting applySimpleSchemaField, applyTypeSchemaField, and per-field apply helpers removes the CRAP finding.","files_changed":["src/llm/provider-adapters-utils.js"]}}
{"run":200,"commit":"5d02e58","metric":116,"metrics":{"fallow_health_score":77.6,"complexity_introduced":23,"dead_code":0,"dupes":0,"tests_pass":0,"lint_pass":1,"typecheck_pass":1},"status":"keep","description":"refactor(settings): decompose invalidateFamilyState","timestamp":1784037070837,"segment":3,"confidence":4.142857142857143,"asi":{"hypothesis":"invalidateFamilyState mixed loop guards, model-state reset, active-family flags, and conditional render/reload calls. Extracting shouldProcessFamily, resetFamilyStatus, maybeRenderActive, and maybeReloadActive removes the CRAP finding.","files_changed":["public/js/features/admin/settings/policies.js"]}}
{"run":201,"commit":"5d02e58","metric":115,"metrics":{"fallow_health_score":77.6,"complexity_introduced":23,"dead_code":0,"dupes":0,"tests_pass":0,"lint_pass":1,"typecheck_pass":1},"status":"keep","description":"refactor(chat): decompose onListClick into toggle/citation handlers","timestamp":1784037354158,"segment":3,"confidence":4,"asi":{"hypothesis":"onListClick handled thinking toggle, tool toggle, and citation click inline with nested if/returns. Extracting handleThinkingToggle, handleToolToggle, and handleCitationClick removes the CRAP finding.","files_changed":["public/js/features/chat/chat-message-list-controller.js"]}}
{"run":202,"commit":"5d02e58","metric":113,"metrics":{"fallow_health_score":77.6,"complexity_introduced":23,"dead_code":0,"dupes":0,"tests_pass":0,"lint_pass":1,"typecheck_pass":1},"status":"keep","description":"refactor(chat): decompose subscribe and cleanup callbacks","timestamp":1784037721137,"segment":3,"confidence":4.090909090909091,"asi":{"hypothesis":"The subscribe callback and cleanup arrow mixed multiple conditional branches and optional-chain teardown calls. Extracting updateSidebarBackdrop, updateActiveChat, updateChatList, clearChatTimers, disposeChatModals, removeChatEventListeners, maybeCall, and removeEventListenerIfPresent removes the CRAP findings.","files_changed":["public/js/features/chat/chat.js"]}}
{"run":203,"commit":"5d02e58","metric":113,"metrics":{"fallow_health_score":77.6,"complexity_introduced":24,"dead_code":0,"dupes":0,"tests_pass":0,"lint_pass":1,"typecheck_pass":1},"status":"keep","description":"refactor(chat): extract tool selection section and row renderers","timestamp":1784038157967,"segment":3,"confidence":4.090909090909091,"asi":{"hypothesis":"The nested render server map arrow and tool map arrow in renderToolsMenu had high cyc. Extracting renderToolRow and renderToolServerSection removes the outer arrow finding but introduces new functions. Total unchanged.","files_changed":["public/js/features/chat/message-input-tool-selection.js"]}}
{"run":204,"commit":"5d02e58","metric":111,"metrics":{"fallow_health_score":77.6,"complexity_introduced":24,"dead_code":0,"dupes":0,"tests_pass":0,"lint_pass":1,"typecheck_pass":1},"status":"keep","description":"refactor(eslint): extract path and call predicates in no-console-logging rule","timestamp":1784038539564,"segment":3,"confidence":4.088888888888889,"asi":{"hypothesis":"The create and MemberExpression functions in the no-console-logging rule had cyclomatic complexity just above the threshold. Extracting isExemptPath and isBannedConsoleCall predicates reduces both functions below the CRAP threshold.","files_changed":["eslint-rules/no-console-logging.cjs"]}}
{"run":205,"commit":"5d02e58","metric":110,"metrics":{"fallow_health_score":77.6,"complexity_introduced":23,"dead_code":0,"dupes":0,"tests_pass":0,"lint_pass":1,"typecheck_pass":1},"status":"keep","description":"refactor(chat): decompose computeMessageContext into small resolvers","timestamp":1784038870845,"segment":3,"confidence":4.043478260869565,"asi":{"hypothesis":"computeMessageContext mixed id resolution, override detection, content selection, streaming detection, and model name lookup. Extracting small resolver helpers with cyc <= 4 removes the high-CRAP finding and lowers complexity_introduced by 1.","files_changed":["public/js/features/chat/chat-message-list-html.js"]}}
{"run":206,"commit":"5d02e58","metric":109,"metrics":{"fallow_health_score":77.6,"complexity_introduced":23,"dead_code":0,"dupes":0,"tests_pass":0,"lint_pass":1,"typecheck_pass":1},"status":"keep","description":"refactor(chat): decompose bindToolsMenuEvents click handler into dispatch table","timestamp":1784039161984,"segment":3,"confidence":4.086956521739131,"asi":{"hypothesis":"The tools-menu click handler had multiple nested conditional branches for all-on/off, server toggle/expand, and tool toggle. Extracting small predicate and action handlers and routing via a handler table removes the high-CRAP arrow.","files_changed":["public/js/features/chat/message-input-tool-selection.js"]}}
{"run":207,"commit":"5d02e58","metric":108,"metrics":{"fallow_health_score":77.6,"complexity_introduced":22,"dead_code":0,"dupes":0,"tests_pass":0,"lint_pass":1,"typecheck_pass":1},"status":"keep","description":"refactor(chat): split renderToolServerSection into small markup helpers","timestamp":1784039457383,"segment":3,"confidence":4.130434782608695,"asi":{"hypothesis":"renderToolServerSection had many inline ternaries for toggle state and expansion. Extracting tiny predicate helpers for aria-pressed, labels, CSS classes, chevrons, and pluralization, plus separate button renderers, lowers its cyclomatic complexity below the threshold.","files_changed":["public/js/features/chat/message-input-tool-selection.js"]}}
