{"run":265,"commit":"06bf690","metric":65,"metrics":{"fallow_health_score":77.6,"complexity_introduced":0,"dead_code":0,"dupes":0,"tests_pass":1,"lint_pass":1,"typecheck_pass":1},"status":"keep","description":"refactor(test): collapse matchesModelQuery mock to field-scan predicate","timestamp":1784142944168,"segment":3,"confidence":3.6315789473684212,"asi":{"hypothesis":"The matchesModelQuery mock in models-public-list.test.js was the sole introduced complexity finding (cyc=12). Replacing four sequential || includes checks with a field-array .some() scan reduces the arrow below the CRAP threshold, driving complexity_introduced to 0 and flipping audit_verdict to pass.","next_action_hint":"Audit verdict is now PASS and all quality gates are green. Continue reducing functions_above_threshold by targeting remaining single-function non-introduced files: admin/settings/integrations.js, admin/settings/security.js, admin/users/roles.js, src/chat/assistant-runner.js."}}
{"run":266,"commit":"06bf690","metric":64,"metrics":{"fallow_health_score":77.6,"complexity_introduced":0,"dead_code":0,"dupes":0,"tests_pass":1,"lint_pass":1,"typecheck_pass":1},"status":"keep","description":"refactor(admin): extract tool-server row helpers from integrations settings markup","timestamp":1784143553754,"segment":3,"confidence":3.6578947368421053,"asi":{"hypothesis":"The getToolServersMarkup IIFE map callback had cyc=14 from many server-enabled/ACL/expanded ternaries. Extracting renderToolServerRow, buildToolServerHeader, buildToolServerActions, buildToolServerToolsSection, and small class builders, plus hoisting renderToolMarkup/renderToolToggle/renderToolDescription to module level, removes the high-CRAP arrow.","next_action_hint":"Continue reducing functions_above_threshold. Remaining single-function non-introduced files: admin/settings/security.js (no coverage - skip), admin/users/roles.js, src/chat/assistant-runner.js. Also consider multi-function files with moderate CRAP: session-bootstrap.js, policies.js, overview-controller.js."}}
{"run":267,"commit":"06bf690","metric":63,"metrics":{"fallow_health_score":77.6,"complexity_introduced":0,"dead_code":0,"dupes":0,"tests_pass":1,"lint_pass":1,"typecheck_pass":1},"status":"keep","description":"refactor(bootstrap): extract pagination and reset-state helpers from applyChatsState","timestamp":1784143960717,"segment":3,"confidence":3.6842105263157894,"asi":{"hypothesis":"applyChatsState had cyc=11 from pagination object construction and a large resetConversationState ternary. Extracting buildChatsPagination and buildResetConversationState removes those branches and drops the arrow below the CRAP threshold.","next_action_hint":"Continue reducing functions_above_threshold. Remaining non-introduced CRAP files: admin/settings/security.js (no coverage - skip), admin/users/overview-controller.js, admin/users/roles.js, admin/settings/policies.js, src/chat/assistant-runner.js, public/js/bootstrap/session-bootstrap.js (initRBAC)."}}
{"run":268,"commit":"06bf690","metric":62,"metrics":{"fallow_health_score":77.6,"complexity_introduced":0,"dead_code":0,"dupes":0,"tests_pass":1,"lint_pass":1,"typecheck_pass":1},"status":"keep","description":"refactor(bootstrap): extract RBAC state apply helpers from initRBAC","timestamp":1784144260309,"segment":3,"confidence":3.6623376623376624,"asi":{"hypothesis":"initRBAC had cyc=11 from preloaded/fetched/fallback branches and nested ternaries. Extracting applyPreloadedRbacState, applyFetchedRbacState, and applyFallbackRbacState collapses the parent to guard + dispatch.","next_action_hint":"Continue reducing functions_above_threshold. Remaining targets: admin/users/overview-controller.js, admin/users/roles.js, admin/settings/policies.js, src/chat/assistant-runner.js."}}
{"run":269,"commit":"06bf690","metric":61,"metrics":{"fallow_health_score":77.6,"complexity_introduced":0,"dead_code":0,"dupes":0,"tests_pass":1,"lint_pass":1,"typecheck_pass":1},"status":"keep","description":"refactor(admin): extract option builders from policies render function","timestamp":1784144624017,"segment":3,"confidence":3.641025641025641,"asi":{"hypothesis":"The nested render() function in policies.js had cyc=10 from loading/error guards and option-ternaries for groups/families. Extracting buildGroupOptions, buildFamilyOptions, areAllVisibleSelected, and countActiveVisibilityFilters removes enough decision points to drop render below the CRAP threshold.","next_action_hint":"Continue reducing functions_above_threshold. Remaining targets: admin/users/overview-controller.js, admin/users/roles.js, admin/settings/policies.js (renderPoliciesSettings), src/chat/assistant-runner.js."}}
{"run":270,"commit":"06bf690","metric":60,"metrics":{"fallow_health_score":77.6,"complexity_introduced":0,"dead_code":0,"dupes":0,"tests_pass":1,"lint_pass":1,"typecheck_pass":1},"status":"keep","description":"refactor(admin): extract pagination and loading helpers from updateView","timestamp":1784145007481,"segment":3,"confidence":3.7142857142857144,"asi":{"hypothesis":"updateView had cyc=14 from pagination fallback chains, loading ternary, and control disable expressions. Extracting resolveOverviewPagination, resolveTableLoadingState, renderOverviewTableBody, and updatePaginationControls removes enough decision points.","next_action_hint":"Continue reducing functions_above_threshold. Remaining targets: admin/users/overview-controller.js arrow, admin/users/roles.js, admin/settings/policies.js (renderPoliciesSettings), src/chat/assistant-runner.js."}}
{"run":271,"commit":"HEAD","metric":60,"metrics":{"fallow_health_score":77.6,"complexity_introduced":1,"dead_code":0,"dupes":0,"tests_pass":1,"lint_pass":1,"typecheck_pass":1},"status":"discard","description":"refactor(admin): extract handleEditUserClick from bindRowActions arrow","timestamp":1784145552011,"segment":3,"confidence":3.6666666666666665,"asi":{"hypothesis":"Extracting the edit-user click handler arrow into handleEditUserClick should remove the high-CRAP arrow from bindRowActions.","next_action_hint":"The extracted handleEditUserClick itself is flagged as introduced complexity. Either decompose it into smaller helpers (saveEdit, attachEditModalListeners) before extracting, or target a different remaining file such as roles.js or policies.js renderPoliciesSettings.","rollback_reason":"functions_above_threshold unchanged while complexity_introduced regressed to 1, causing audit_verdict to fail."}}
{"run":272,"commit":"06bf690","metric":59,"metrics":{"fallow_health_score":77.6,"complexity_introduced":0,"dead_code":0,"dupes":0,"tests_pass":1,"lint_pass":1,"typecheck_pass":1},"status":"keep","description":"refactor(admin): decompose renderRolesPage into state/load/shell/action helpers","timestamp":1784145927793,"segment":3,"confidence":3.789473684210526,"asi":{"hypothesis":"renderRolesPage had cyc=12 from state init, loading/error branches, shell HTML, and event listeners. Extracting getOrCreateRolesState, resolveRolesLoadingPhase, renderRolesShell, createRolesActions, and bindRolesPageEvents drops the parent below the CRAP threshold and reduces functions_above_threshold.","next_action_hint":"Continue reducing functions_above_threshold. Remaining targets: admin/settings/policies.js (renderPoliciesSettings), src/chat/assistant-runner.js (streamAssistantWithTools), public/js/features/admin/users/overview-controller.js arrow."}}
{"run":273,"commit":"06bf690","metric":58,"metrics":{"fallow_health_score":77.6,"complexity_introduced":0,"dead_code":0,"dupes":0,"tests_pass":1,"lint_pass":1,"typecheck_pass":1},"status":"keep","description":"refactor(admin): decompose edit-user click handler arrow in overview-controller","timestamp":1784146377102,"segment":3,"confidence":3.918918918918919,"asi":{"hypothesis":"The delegated edit-user click handler arrow had cyc=10/CRAP=31.6. Extracting buildEditUserContext, mountEditUserModal, createEditUserHandlers, and attachEditUserListeners drops all helpers below the CRAP threshold and removes one function from functions_above_threshold.","next_action_hint":"Continue reducing functions_above_threshold. Remaining targets: admin/settings/policies.js (renderPoliciesSettings), src/chat/assistant-runner.js (streamAssistantWithTools)."}}
{"run":274,"commit":"HEAD","metric":58,"metrics":{"fallow_health_score":77.6,"complexity_introduced":1,"dead_code":0,"dupes":0,"tests_pass":1,"lint_pass":1,"typecheck_pass":1},"status":"discard","description":"refactor(admin): extract validation/save helpers from updateResendApiKey","timestamp":1784146757423,"segment":3,"confidence":3.918918918918919,"asi":{"hypothesis":"updateResendApiKey had cyc=12 from validation, API call, response check, success commit, and error rollback branches. Extracting helpers should drop the parent below the CRAP threshold.","next_action_hint":"Try a different single-function file where the decomposition pattern worked, or extract smaller helpers that don't individually exceed the threshold.","rollback_reason":"functions_above_threshold regressed 58→59 and complexity_introduced increased to 1; the parent or extracted helpers still exceed the CRAP threshold."}}
{"run":275,"commit":"HEAD","metric":58,"metrics":{"fallow_health_score":77.6,"complexity_introduced":0,"dead_code":0,"dupes":0,"tests_pass":1,"lint_pass":1,"typecheck_pass":1},"status":"discard","description":"refactor(admin): extract renderPoliciesPage and option builders from renderPoliciesSettings","timestamp":1784147390927,"segment":3,"confidence":3.918918918918919,"asi":{"hypothesis":"renderPoliciesSettings had cyc=11 from the inner render() and option builders. Hoisting render() to module level and passing dependencies should reduce parent cyclomatic complexity.","next_action_hint":"Try extracting smaller non-render helpers (invalidation handlers, abort helpers) or target assistant-runner.js. The render() function itself may still be flagged when hoisted.","rollback_reason":"functions_above_threshold unchanged at 58; the hoisted renderPoliciesPage likely became flagged or the parent remained above threshold."}}
{"run":276,"commit":"06bf690","metric":57,"metrics":{"fallow_health_score":77.6,"complexity_introduced":0,"dead_code":0,"dupes":0,"tests_pass":1,"lint_pass":1,"typecheck_pass":1},"status":"keep","description":"refactor(placeholder): extract suggestion/welcome helpers from render","timestamp":1784147866689,"segment":3,"confidence":3.945945945945946,"asi":{"hypothesis":"The inner render() in renderPlaceholder had multiple branches for messages check, model resolution, welcome screen creation, and suggestion grid rendering. Extracting helpers drops it below the threshold.","next_action_hint":"Continue with remaining health findings: public/js/features/admin/settings/connections.js, public/js/features/admin/settings/integrations-event-handlers.js, public/js/features/admin/settings/policies-rendering.js, public/js/features/admin/users/groups-modal.js, chat-message-* files, etc."}}
{"run":277,"commit":"06bf690","metric":56,"metrics":{"fallow_health_score":77.6,"complexity_introduced":0,"dead_code":0,"dupes":0,"tests_pass":1,"lint_pass":1,"typecheck_pass":1},"status":"keep","description":"refactor(connections): extract connection row/list helpers","timestamp":1784148260692,"segment":3,"confidence":3.972972972972973,"asi":{"hypothesis":"getConnectionsListMarkup had cyc from loading/empty branches and large inline row template. Extracting dedupeConnections, renderConnectionActions, renderConnectionRow, and renderConnectionsList drops the arrow below threshold.","next_action_hint":"Continue with remaining health findings: public/js/features/admin/settings/connections.js render, public/js/features/admin/settings/integrations-event-handlers.js, public/js/features/admin/settings/policies-rendering.js, etc."}}
{"run":278,"commit":"HEAD","metric":56,"metrics":{"fallow_health_score":77.6,"complexity_introduced":1,"dead_code":0,"dupes":0,"tests_pass":1,"lint_pass":1,"typecheck_pass":1},"status":"discard","description":"refactor(connections): extract shell/modal helpers — complexity_introduced=1 regression","timestamp":1784148673799,"segment":3,"confidence":3.92,"asi":{"hypothesis":"render() in connections.js was flagged; extracting renderConnectionsShell and renderConnectionModalMarkup would reduce render complexity. One extracted helper exceeded CRAP threshold and was marked introduced complexity.","next_action_hint":"Revert and target a different file. Extracted helpers must stay below CRAP threshold. Try policies-rendering.js, chat-message-actions.js, or another file where decomposition into tiny helpers has worked.","rollback_reason":"complexity_introduced regressed from 0 to 1"}}
{"run":279,"commit":"HEAD","metric":56,"metrics":{"fallow_health_score":77.6,"complexity_introduced":1,"dead_code":0,"dupes":0,"tests_pass":1,"lint_pass":1,"typecheck_pass":1},"status":"discard","description":"refactor(policies): extract renderResourceRow — complexity_introduced=1 regression","timestamp":1784149071994,"segment":3,"confidence":3.972972972972973,"asi":{"hypothesis":"renderResourceList map callback had high CRAP. Extracting renderResourceRow should reduce it, but the helper itself became an introduced complexity finding.","next_action_hint":"Need to decompose renderResourceRow further into smaller helpers so no single helper exceeds CRAP threshold. Try extracting dependency warning markup, owner/visibility badge, and edit button into separate tiny helpers.","rollback_reason":"complexity_introduced regressed from 0 to 1"}}
{"run":280,"commit":"06bf690","metric":55,"metrics":{"fallow_health_score":77.6,"complexity_introduced":0,"dead_code":0,"dupes":0,"tests_pass":1,"lint_pass":1,"typecheck_pass":1},"status":"keep","description":"refactor(integrations): convert tool-servers click handler to dispatch table","timestamp":1784149430742,"segment":3,"confidence":3.9466666666666668,"asi":{"hypothesis":"The #tool-servers-list click handler arrow had many sequential target.closest branches. Replacing with INTEGRATIONS_CLICK_HANDLERS dispatch table and extracting per-concern handlers drops the arrow below CRAP threshold.","next_action_hint":"Continue with remaining health findings: public/js/features/admin/settings/policies-rendering.js renderResourceList, public/js/features/admin/settings/policies.js renderPoliciesSettings, public/js/features/admin/users/groups-modal.js, chat-message-* files, etc."}}
{"run":281,"commit":"HEAD","metric":55,"metrics":{"fallow_health_score":77.6,"complexity_introduced":0,"dead_code":0,"dupes":0,"tests_pass":1,"lint_pass":1,"typecheck_pass":1},"status":"discard","description":"refactor(policies): extract buildPoliciesMarkup — no metric improvement","timestamp":1784149804753,"segment":3,"confidence":3.8947368421052633,"asi":{"hypothesis":"render() in policies.js was flagged; extracting the large inline layout template to buildPoliciesMarkup should reduce its CRAP. Did not reduce functions_above_threshold.","next_action_hint":"render() may still have enough branches (loading/error/idle states) to exceed threshold. Extract loading/error shell helpers or decompose further. Otherwise target another file.","rollback_reason":"functions_above_threshold unchanged at 55"}}
{"run":282,"commit":"HEAD","metric":56,"metrics":{"fallow_health_score":77.6,"complexity_introduced":2,"dead_code":0,"dupes":0,"tests_pass":1,"lint_pass":1,"typecheck_pass":1},"status":"discard","description":"refactor(groups): extract buildGroupModalBody/Footer — complexity_introduced=2 regression","timestamp":1784150201731,"segment":3,"confidence":3.8947368421052633,"asi":{"hypothesis":"renderGroupModal had a large body/footer HTML string. Extracting buildGroupModalBody and buildGroupModalFooter should reduce it, but both helpers became introduced complexity findings.","next_action_hint":"Avoid extracting large HTML helpers that themselves exceed CRAP. Try dispatch-table refactor for event handlers or decompose smaller logic. Target files with clear sequential branches rather than large templates.","rollback_reason":"complexity_introduced regressed 0→2 and functions_above_threshold increased 55→56"}}
{"run":283,"commit":"HEAD","metric":55,"metrics":{"fallow_health_score":77.6,"complexity_introduced":1,"dead_code":0,"dupes":0,"tests_pass":1,"lint_pass":1,"typecheck_pass":1},"status":"discard","description":"refactor(chat): extract handleSaveCopyClick — complexity_introduced=1 regression","timestamp":1784150588464,"segment":3,"confidence":3.8947368421052633,"asi":{"hypothesis":"save-copy click handler arrow had high CRAP. Extracting to named function should reduce parent, but extracted helper itself was flagged as introduced complexity.","next_action_hint":"Need to decompose handleSaveCopyClick into smaller helpers (resolveMessageId, buildBranchPayload, applyCopyResult, showCopyError) to keep each under CRAP threshold, or choose a different target.","rollback_reason":"complexity_introduced regressed 0→1"}}
{"run":284,"commit":"06bf690","metric":54,"metrics":{"fallow_health_score":77.6,"complexity_introduced":0,"dead_code":0,"dupes":0,"tests_pass":1,"lint_pass":1,"typecheck_pass":1},"status":"keep","description":"refactor(chat): decompose save-copy click handler into small helpers","timestamp":1784150969232,"segment":3,"confidence":3.9210526315789473,"asi":{"hypothesis":"save-copy click handler arrow had high CRAP. Extracting resolveCopyTargetId, findCopySourceMessage, buildCopyBranchPayload, applyCopySuccess, showCopyError, and handleSaveCopyClick keeps each helper below threshold and removes the arrow from functions_above_threshold.","next_action_hint":"Continue with remaining health findings: chat-message-delete-actions.js, chat-message-retry-actions.js, chat-message-stream-resume.js, chat-message-stream-send.js, chat-render-controller.js, chat-stream-controller.js, model-selector-notice-helpers.js, connection-modal.js, server-modal.js, store.js, src/chat/assistant-runner.js, src/llm/provider-adapters.js, src/mcp/client.js, src/routers/*."}}
{"run":285,"commit":"HEAD","metric":54,"metrics":{"fallow_health_score":77.6,"complexity_introduced":1,"dead_code":0,"dupes":0,"tests_pass":1,"lint_pass":1,"typecheck_pass":1},"status":"discard","description":"refactor(chat): extract loadModelsOnce from ensureModelsLoaded — complexity_introduced=1 regression","timestamp":1784151386367,"segment":3,"confidence":3.9210526315789473,"asi":{"hypothesis":"ensureModelsLoaded contained an IIFE arrow with cache/fetch branches. Extracting loadModelsOnce should reduce it, but the helper was flagged as introduced complexity.","next_action_hint":"Decompose loadModelsOnce into smaller helpers (loadFromCache, loadFromFetch, handleModelLoadError) or target a different file.","rollback_reason":"complexity_introduced regressed 0→1"}}
{"run":286,"commit":"06bf690","metric":53,"metrics":{"fallow_health_score":77.6,"complexity_introduced":0,"dead_code":0,"dupes":0,"tests_pass":1,"lint_pass":1,"typecheck_pass":1},"status":"keep","description":"refactor(chat): decompose ensureModelsLoaded IIFE into small helpers","timestamp":1784151758962,"segment":3,"confidence":3.896103896103896,"asi":{"hypothesis":"ensureModelsLoaded IIFE arrow had cache/fetch/error branches. Extracting processCachedModels, processFetchedModels, handleModelsLoadError, and loadModelsOnce keeps all helpers below CRAP threshold and removes the arrow from functions_above_threshold.","next_action_hint":"Continue with remaining health findings: chat-message-delete-actions.js, chat-message-retry-actions.js, chat-message-stream-resume.js, chat-message-stream-send.js, chat-render-controller.js, chat-stream-controller.js, connection-modal.js, server-modal.js, store.js, src/chat/assistant-runner.js, src/llm/provider-adapters.js, src/mcp/client.js, src/routers/*."}}
{"run":287,"commit":"06bf690","metric":51,"metrics":{"fallow_health_score":77.6,"complexity_introduced":0,"dead_code":0,"dupes":0,"tests_pass":1,"lint_pass":1,"typecheck_pass":1},"status":"keep","description":"refactor(chat): decompose delete click handler and applyOptimisticDelete into small helpers","timestamp":1784152147282,"segment":3,"confidence":3.8974358974358974,"asi":{"hypothesis":"chat-message-delete-actions.js click handler arrow and applyOptimisticDelete were both flagged. Extracting collectDescendantIds to module level, and decomposing applyOptimisticDelete into abortStreamIfDeleted, computeRemainingMessages, updateLeafToLastRemaining, pruneDeletedBranchSelections removes both findings from functions_above_threshold.","next_action_hint":"Continue with remaining health findings: chat-message-retry-actions.js, chat-message-stream-resume.js, chat-message-stream-send.js, chat-render-controller.js, chat-stream-controller.js, connection-modal.js, server-modal.js, store.js, src/chat/assistant-runner.js, src/llm/provider-adapters.js, src/mcp/client.js, src/routers/*."}}
{"run":288,"commit":"HEAD","metric":51,"metrics":{"fallow_health_score":77.6,"complexity_introduced":1,"dead_code":0,"dupes":0,"tests_pass":1,"lint_pass":1,"typecheck_pass":1},"status":"discard","description":"refactor(chat): extract empty-state/loading helpers from drawMessages — complexity_introduced=1 regression","timestamp":1784152513761,"segment":3,"confidence":3.948051948051948,"asi":{"hypothesis":"drawMessages had empty-state branches and loading skeleton. Extracting renderEmptyChatState and buildLoadingSkeletonHtml should reduce it, but one helper was flagged as introduced complexity.","next_action_hint":"Decompose further or target a different file. The bindChatMessageActions call and scroll logic may still push drawMessages over threshold.","rollback_reason":"complexity_introduced regressed 0→1"}}
