{"run":289,"commit":"06bf690","metric":50,"metrics":{"fallow_health_score":77.6,"complexity_introduced":0,"dead_code":0,"dupes":0,"tests_pass":1,"lint_pass":1,"typecheck_pass":1},"status":"keep","description":"refactor(chat): decompose stream poll arrow into small helpers","timestamp":1784152871799,"segment":3,"confidence":4.026315789473684,"asi":{"hypothesis":"poll arrow in chat-stream-controller.js had timeout, response-ok, running-status, and error branches. Extracting handlePollStop, processPollMessage, and fetchPollStatus keeps all helpers below CRAP threshold and removes the arrow from functions_above_threshold.","next_action_hint":"Continue with remaining health findings: chat-message-retry-actions.js, chat-message-stream-resume.js, chat-message-stream-send.js, chat-render-controller.js drawMessages, connection-modal.js, server-modal.js, store.js, src/chat/assistant-runner.js, src/llm/provider-adapters.js, src/mcp/client.js, src/routers/*."}}
{"run":290,"commit":"HEAD","metric":50,"metrics":{"fallow_health_score":77.6,"complexity_introduced":1,"dead_code":0,"dupes":0,"tests_pass":1,"lint_pass":1,"typecheck_pass":1},"status":"discard","description":"refactor(store): decompose setState into small helpers — complexity_introduced=1 regression","timestamp":1784153282110,"segment":3,"confidence":3.9740259740259742,"asi":{"hypothesis":"setState had many branches for replace/nested/scalar updates and persistence. Extracting helpers should reduce it, but one helper exceeded the CRAP threshold and was flagged as introduced complexity.","next_action_hint":"Target files with sequential branches where helper extraction has worked, such as src/chat/assistant-runner.js, src/llm/provider-adapters.js, or connection-modal.js.","rollback_reason":"complexity_introduced regressed 0→1"}}
{"run":291,"commit":"HEAD","metric":51,"metrics":{"fallow_health_score":77.6,"complexity_introduced":2,"dead_code":0,"dupes":0,"tests_pass":1,"lint_pass":1,"typecheck_pass":1},"status":"discard","description":"refactor(admin): split handleAdminToolServersOAuth into start/callback handlers — complexity_introduced=2 regression and metric worsened","timestamp":1784154373931,"segment":3,"confidence":4.026315789473684,"asi":{"hypothesis":"Splitting handleAdminToolServersOAuth into handleOAuthStart and handleOAuthCallback should reduce functions_above_threshold, but both extracted helpers were flagged as introduced complexity and functions_above_threshold increased from 50 to 51.","next_action_hint":"Target functions in already-modified files or decompose further so extracted helpers stay below all thresholds. Avoid extracting large functions from unmodified files.","rollback_reason":"complexity_introduced regressed 0→2 and functions_above_threshold increased 50→51"}}
{"run":292,"commit":"HEAD","metric":82,"metrics":{"fallow_health_score":77.6,"complexity_introduced":12,"dead_code":0,"dupes":0,"tests_pass":1,"lint_pass":1,"typecheck_pass":1},"status":"discard","description":"refactor(chat): extract resume event/delta handlers into helpers — major complexity_introduced regression","timestamp":1784154793106,"segment":3,"confidence":4.026315789473684,"asi":{"hypothesis":"Extracting handleResumeEvent and handleResumeDelta helpers from startChatResumeStream should reduce parent complexity, but the helpers themselves were flagged as introduced complexity and functions_above_threshold jumped from 50 to 82.","next_action_hint":"Avoid extracting helpers with many branches that exceed thresholds. Target functions where decomposition into very small helpers has worked, or accept the current floor.","rollback_reason":"complexity_introduced regressed 0→12 and functions_above_threshold increased 50→82"}}
{"run":293,"commit":"HEAD","metric":81,"metrics":{"fallow_health_score":77.6,"complexity_introduced":11,"dead_code":0,"dupes":0,"tests_pass":1,"lint_pass":1,"typecheck_pass":1},"status":"discard","description":"refactor(chat): extract poll helpers into module functions — major complexity_introduced regression","timestamp":1784155141490,"segment":3,"confidence":4.135135135135135,"asi":{"hypothesis":"Extracting poll helpers into module-level functions should reduce parent complexity, but the helpers themselves were flagged as introduced complexity and functions_above_threshold jumped to 81.","next_action_hint":"Module-level helper extractions in modified files are being flagged as introduced. Need to keep helpers below CRAP/cyc/cog thresholds or target non-introduced refactor patterns.","rollback_reason":"complexity_introduced regressed 0→11 and functions_above_threshold increased 50→81"}}
{"run":294,"commit":"06bf690","metric":81,"metrics":{"fallow_health_score":77.6,"complexity_introduced":11,"dead_code":0,"dupes":0,"tests_pass":1,"lint_pass":1,"typecheck_pass":1},"status":"keep","description":"refactor(stream-lifecycle): decompose sendErrorAndClose into small helpers","timestamp":1784160744208,"segment":3,"confidence":4.135135135135135,"asi":{"hypothesis":"sendErrorAndClose in src/chat/stream-lifecycle.js had CRAP above threshold due to nested try/catch blocks and ternary serialization. Extracting serializeCitations, serializeToolCalls, persistAssistantErrorMessage, publishAssistantErrorEvent, and emitErrorSsePayload keeps all helpers below thresholds and drops the parent below CRAP, reducing functions_above_threshold by 1.","next_action_hint":"Continue targeting single-function non-introduced files or functions just above threshold with sequential branches. Candidates: src/chat/assistant-runner.js, src/llm/provider-adapters.js, src/mcp/client.js, src/routers/models/models-public-list.js."}}
{"run":295,"commit":"06bf690","metric":80,"metrics":{"fallow_health_score":77.6,"complexity_introduced":11,"dead_code":0,"dupes":0,"tests_pass":1,"lint_pass":1,"typecheck_pass":1},"status":"keep","description":"refactor(admin): extract avatar and delete-button helpers from renderUserRows map callback","timestamp":1784161222719,"segment":3,"confidence":4.135135135135135,"asi":{"hypothesis":"The renderUserRows map callback in overview-render.js had CRAP just above threshold from nested avatar and delete-button ternaries. Extracting buildUserAvatarHtml and buildUserDeleteButtonHtml removes those branches and drops the callback below the threshold.","next_action_hint":"Continue targeting single-function files with functions just above CRAP threshold. Candidates: public/js/features/admin/settings/policies.js render (cyc=10/cog=9/CRAP=31.6), public/js/features/admin/users/overview-controller.js arrow, scripts/test-e2e.js stripQuotes/seedUser."}}
{"run":296,"commit":"HEAD","metric":78,"metrics":{"fallow_health_score":77.6,"complexity_introduced":11,"dead_code":0,"dupes":0,"tests_pass":1,"lint_pass":1,"typecheck_pass":1},"status":"keep","description":"refactor(test-e2e): simplify stripQuotes with regex and extract seed credential helper","timestamp":1784161561656,"segment":3,"confidence":4.191780821917808,"asi":{"hypothesis":"scripts/test-e2e.js had stripQuotes and seedUser at CRAP=30 threshold. Rewriting stripQuotes with a regex and extracting readSeedCredentials drops both functions below the CRAP threshold.","next_action_hint":"Continue with other low-CRAP single-function files: public/js/features/admin/settings/policies.js render, public/js/features/admin/users/overview-controller.js arrow, public/js/features/chat/chat-message-stream-resume.js startChatResumeStream, src/routers/auth-register.js handleRegister."}}
{"run":297,"commit":"HEAD","metric":77,"metrics":{"fallow_health_score":77.6,"complexity_introduced":11,"dead_code":0,"dupes":0,"tests_pass":1,"lint_pass":1,"typecheck_pass":1},"status":"keep","description":"refactor(chat): decompose ensureModelsLoaded into small helpers","timestamp":1784175705359,"segment":3,"confidence":4.25,"asi":{"hypothesis":"The ensureModelsLoaded IIFE arrow in model-selector-notice-helpers.js had CRAP above threshold from cache/fetch branches and request-generation guard. Extracting applyCachedModels, applyFetchedModels, handleModelsLoadError, and loadModelsOnce keeps all helpers below thresholds and drops the parent below CRAP.","next_action_hint":"Continue with remaining low-CRAP single-function files: public/js/features/admin/settings/policies.js render, public/js/features/admin/users/overview-controller.js arrow, src/routers/auth-register.js handleRegister, src/routers/chat-message-send.js parseSendBody."}}
{"run":298,"commit":"HEAD","metric":76,"metrics":{"fallow_health_score":77.6,"complexity_introduced":10,"dead_code":0,"dupes":0,"tests_pass":1,"lint_pass":1,"typecheck_pass":1},"status":"keep","description":"refactor(routers): decompose parseSendBody into validation helpers","timestamp":1784175943102,"segment":3,"confidence":4.309859154929577,"asi":{"hypothesis":"parseSendBody in chat-message-send.js had cyc=11 from sequential JSON parse, message validation, model resolution, and attachment count checks. Extracting parseJsonBody, extractMessageContent, resolveSendToolNames, resolveSendModel, normalizeSendAttachmentIds, and validateAttachmentCount drops the parent below the CRAP threshold.","next_action_hint":"Continue with remaining single-function targets: src/chat/assistant-runner.js streamAssistantWithTools, public/js/features/admin/settings/policies.js render, src/routers/auth-register.js handleRegister, public/js/features/admin/settings/integrations-event-handlers.js arrow."}}
{"run":299,"commit":"HEAD","metric":75,"metrics":{"fallow_health_score":77.6,"complexity_introduced":10,"dead_code":0,"dupes":0,"tests_pass":1,"lint_pass":1,"typecheck_pass":1},"status":"keep","description":"refactor(test): remove optional chains from acl modal shell test to reduce CRAP","timestamp":1784176209810,"segment":3,"confidence":4.371428571428571,"asi":{"hypothesis":"The test callback had cyc=10 from many optional-chain assertions. Replacing optional chains with direct property access drops the arrow below the CRAP threshold.","next_action_hint":"Continue with similar test-file low-CRAP findings: tests/unit/public-chat-stream.test.js push, and remaining source targets: src/chat/assistant-runner.js, public/js/features/admin/settings/policies.js, public/js/bootstrap/session-bootstrap.js."}}
{"run":300,"commit":"HEAD","metric":74,"metrics":{"fallow_health_score":77.6,"complexity_introduced":10,"dead_code":0,"dupes":0,"tests_pass":1,"lint_pass":1,"typecheck_pass":1},"status":"keep","description":"refactor(test-e2e): extract pid readers from killRecordedWranglerPids","timestamp":1784176406649,"segment":3,"confidence":4.371428571428571,"asi":{"hypothesis":"killRecordedWranglerPids had cyc=6 from try/catch, filter chains, empty check, and nested loops. Extracting readRecordedPids and collectAllPidsToKill drops the parent below the CRAP threshold.","next_action_hint":"Continue with remaining low-CRAP targets: src/routers/auth-register.js handleRegister, public/js/features/admin/settings/policies.js render, tests/unit/public-chat-stream.test.js push, public/js/features/admin/users/overview-controller.js arrow."}}
{"run":301,"commit":"HEAD","metric":73,"metrics":{"fallow_health_score":77.6,"complexity_introduced":10,"dead_code":0,"dupes":0,"tests_pass":1,"lint_pass":1,"typecheck_pass":1},"status":"keep","description":"refactor(test): extract payload helpers from SSE mock push method","timestamp":1784176596261,"segment":3,"confidence":4.371428571428571,"asi":{"hypothesis":"The mock SseLineParser.push had cyc=10 from while/if/try/catch and optional chains. Extracting extractPayloadText and processPayloadText drops push below the CRAP threshold.","next_action_hint":"Continue with remaining low-CRAP targets: public/js/features/admin/settings/policies.js render, public/js/features/admin/users/overview-controller.js arrow, public/js/bootstrap/session-bootstrap.js applyChatsState, src/chat/assistant-runner.js."}}
{"run":303,"commit":"HEAD","metric":72,"metrics":{"fallow_health_score":77.6,"complexity_introduced":10,"dead_code":0,"dupes":0,"tests_pass":1,"lint_pass":1,"typecheck_pass":1},"status":"discard","description":"refactor(admin): remove optional chains from edit-user click handler arrow","timestamp":1784177085245,"segment":3,"confidence":4.5,"asi":{"hypothesis":"The edit-user click handler arrow had cyc=10 from optional-chain property access. Replacing optional chains with direct access should drop the arrow below CRAP threshold.","rollback_reason":"functions_above_threshold unchanged at 72; the arrow still has enough decision points (try/catch, dataset fallbacks, nested callbacks) to stay above the CRAP threshold.","next_action_hint":"Target the same arrow with stronger decomposition (extract buildEditUserContext, mountEditUserModal, createEditUserHandlers) or move to other files like session-bootstrap applyChatsState or src/chat/assistant-runner."}}
{"run":304,"commit":"HEAD","metric":71,"metrics":{"fallow_health_score":77.6,"complexity_introduced":10,"dead_code":0,"dupes":0,"tests_pass":1,"lint_pass":1,"typecheck_pass":1},"status":"keep","description":"refactor(bootstrap): extract pagination and reset helpers from applyChatsState","timestamp":1784177278784,"segment":3,"confidence":4.567164179104478,"asi":{"hypothesis":"applyChatsState had cyc=11 from pagination object construction and reset-conversation ternary. Extracting buildChatsPagination and buildResetConversationState drops the arrow below the CRAP threshold.","next_action_hint":"Continue with remaining targets: initRBAC in same file, renderPoliciesSettings in policies.js, src/chat/assistant-runner.js, src/routers/auth-register.js."}}
{"run":307,"commit":"HEAD","metric":70,"metrics":{"fallow_health_score":77.6,"complexity_introduced":10,"dead_code":0,"dupes":0,"tests_pass":1,"lint_pass":1,"typecheck_pass":1},"status":"discard","description":"refactor(test-e2e): extract parseDevVarLine and shouldApplyDevVar from loadDevVars","timestamp":1784177943184,"segment":3,"confidence":4.636363636363637,"asi":{"hypothesis":"loadDevVars had cyc=9 from loop, regex, optional chain, and conditional application. Extracting helpers should drop the parent below CRAP.","rollback_reason":"functions_above_threshold unchanged at 70; extracted helpers are also flagged due to no coverage and the parent remains above threshold.","next_action_hint":"Target functions with fewer branches and existing coverage, or reduce optional chains directly. Consider scripts/audit-snapshots.js or scripts/secret-scan.cjs only if large reduction possible."}}
{"run":308,"commit":"HEAD","metric":69,"metrics":{"fallow_health_score":77.6,"complexity_introduced":9,"dead_code":0,"dupes":0,"tests_pass":1,"lint_pass":1,"typecheck_pass":1},"status":"keep","description":"refactor(integrations): extract OAuth start body and success helpers from click handler","timestamp":1784178237769,"segment":3,"confidence":4.707692307692308,"asi":{"hypothesis":"The connect-oauth click handler arrow had cyc=11 from guard, try/catch, and nested status update checks. Extracting buildOAuthStartBody and handleOAuthStartSuccess drops the arrow below the CRAP threshold.","next_action_hint":"Continue with remaining targets: bindEvents arrow at top of same file, renderPoliciesSettings, src/chat/assistant-runner.js, src/routers/auth-register.js, chat-message-stream-resume.js."}}
{"run":310,"commit":"HEAD","metric":68,"metrics":{"fallow_health_score":77.6,"complexity_introduced":10,"dead_code":0,"dupes":0,"tests_pass":1,"lint_pass":1,"typecheck_pass":1},"status":"discard","description":"refactor(test): extract resolveAllResult from makeDb mock all() arrow","timestamp":1784178795047,"segment":3,"confidence":4.707692307692308,"asi":{"hypothesis":"The all() arrow in makeDb had cyc=12 from sequential if branches. Extracting resolveAllResult should drop the arrow below CRAP.","rollback_reason":"functions_above_threshold unchanged and complexity_introduced regressed from 9 to 10; the extracted helper itself exceeded the CRAP threshold.","next_action_hint":"Convert the if branches to a data-driven lookup table so the helper has cyc=1, or target other test/source files."}}
{"run":313,"commit":"HEAD","metric":66,"metrics":{"fallow_health_score":77.6,"complexity_introduced":8,"dead_code":0,"dupes":0,"tests_pass":1,"lint_pass":1,"typecheck_pass":1},"status":"keep","description":"refactor(chat): extract getDeleteKey/isDeletePending/syncDeleteButtonState helpers from delete arrow","timestamp":1784185750654,"segment":3,"confidence":4.78125,"asi":{"hypothesis":"Extracting inner function declarations to module-level reduces the arrow's cyc enough to drop below CRAP threshold","next_action_hint":"Continue with remaining targets: applyOptimisticDelete in same file, or src/routers/auth-register.js handleRegister, public/js/features/admin/settings/policies.js renderPoliciesSettings"}}
{"type":"hook","stage":"before","exit_code":1,"duration_ms":22560,"stdout_bytes":307,"timed_out":false}
{"run":314,"commit":"HEAD","metric":66,"metrics":{"fallow_health_score":77.6,"complexity_introduced":8,"dead_code":0,"dupes":0,"tests_pass":1,"lint_pass":1,"typecheck_pass":1},"status":"keep","description":"refactor(chat): extract updateDeletePendingState to fix max-nested-callbacks","timestamp":1784186568774,"segment":3,"confidence":4.707692307692308,"asi":{"hypothesis":"Extracting updateDeletePendingState flattens nesting from 4 to 2, fixing lint","next_action_hint":"Continue with remaining targets: applyOptimisticDelete in same file, src/routers/auth-register.js handleRegister, public/js/features/admin/settings/policies.js renderPoliciesSettings"}}
{"type":"hook","stage":"before","exit_code":null,"duration_ms":39816,"stdout_bytes":8047,"timed_out":true}
{"type":"config","name":"Reduce dupes to 0","metricName":"dupes","metricUnit":"","bestDirection":"lower"}
{"run":309,"commit":"5675987","metric":0,"metrics":{"fallow_health_score":77.6,"functions_above_threshold":66,"complexity_introduced":8,"dead_code":0,"tests_pass":1,"lint_pass":1,"typecheck_pass":1},"status":"keep","description":"Baseline for dupes objective. Primary metric already at target (dupes=0), but audit verdict=fail because complexity_introduced=8, so the 'all gates green' constraint is not yet satisfied.","timestamp":1784196125694,"segment":4,"confidence":null,"asi":{"hypothesis":"Measure baseline for the new 'Reduce dupes to 0' objective after reverting uncommitted source changes.","observation":"dupes=0 is already at target. However, complexity_introduced=8 causes audit_verdict=fail, violating the 'all gates green' requirement in prompt.md. Previous phase apparently left complexity_introduced at 8, not 0 as stated in the prompt.","next_action_hint":"Inspect the 8 introduced complexity findings to see if they can be decomposed safely without introducing new duplication or dead code. If not feasible, the objective as stated is blocked."}}
{"type":"hook","stage":"before","exit_code":null,"duration_ms":34316,"stdout_bytes":738,"timed_out":true}
{"run":310,"commit":"HEAD","metric":0,"metrics":{"fallow_health_score":77.6,"functions_above_threshold":66,"complexity_introduced":9,"dead_code":0,"tests_pass":1,"lint_pass":1,"typecheck_pass":1},"status":"discard","description":"refactor(audit-snapshots): data-driven parseArgs reducer — complexity_introduced regressed 8→9","timestamp":1784196631063,"segment":4,"confidence":null,"asi":{"hypothesis":"parseArgs had cyc=9/CRAP=90. Replacing the imperative for-loop with a reduce + applyArg helper should lower parseArgs cyclomatic complexity.","rollback_reason":"complexity_introduced increased from 8 to 9; either the new helpers introduced their own threshold findings or the file modification shifted attribution.","next_action_hint":"Target a function with clearer sequential branches and no recursive/directory logic. Consider test-e2e.js stripQuotes/loadDevVars if not already decomposed, or a frontend function with existing coverage where CRAP is driven by cyc rather than 0% coverage."}}
{"run":311,"commit":"HEAD","metric":0,"metrics":{"fallow_health_score":77.6,"functions_above_threshold":66,"complexity_introduced":9,"dead_code":0,"tests_pass":1,"lint_pass":1,"typecheck_pass":1},"status":"discard","description":"refactor(test-e2e): decompose loadDevVars into helpers — did not reduce complexity_introduced (stuck at 9)","timestamp":1784197127443,"segment":4,"confidence":null,"asi":{"hypothesis":"loadDevVars had cyc=9/CRAP=90. Extracting applyDevVarLine, isDevVarComment, and tryParseEnvAssignment should drop the finding.","rollback_reason":"complexity_introduced remained at 9; test-e2e.js findings appear to be inherited rather than introduced. The refactor only moved the finding from loadDevVars to applyDevVarLine (cyc=5/CRAP=30).","next_action_hint":"Target backend router functions with cyc>30 that are likely introduced findings, e.g., src/routers/admin/admin-tool-servers-crud.js handleAdminToolServersCrud (cyc=30) or src/routers/auth-register.js handleRegister (cyc=28). Extract route handlers to drop the dispatcher below the cyc threshold."}}
