{"type":"config","name":"Reduce complexity_introduced to 0 (path to fallow health >= 90)","metricName":"complexity_introduced","metricUnit":"","bestDirection":"lower"}
{"run":13,"commit":"ce2b816","metric":93,"metrics":{"fallow_health_score":77.6,"dead_code":0,"dupes":14,"tests_pass":1,"lint_pass":1,"typecheck_pass":1,"dead_code_introduced":0,"duplication_introduced":6},"status":"discard","description":"Clean baseline after pivot. complexity_introduced=93 (98 total findings on changed files; 5 already removed by prior dedup commits). fallow_health_score=77.60 (capped ceiling, secondary monitor), dead_code=0, dupes=14. All quality gates green (scoped tests, lint, typecheck). Target: drop complexity_introduced via systematic decomposition of cyc>20 functions in changed files.","timestamp":1783792237007,"segment":4,"confidence":null,"asi":{"top_targets_handleAdminToolServersOAuth":"src/routers/admin/admin-tool-servers-oauth.js:71 (cyc=49, cog=67) - HUGE function, high decomposition potential but also high risk","top_targets_low_risk_first":"models-helpers.js:137 normalizedConnections (cyc=21, cog=9) - lowest cog, helper file, lowest risk","top_targets_medium_risk":"admin-connections-save.js:84 arrow (cyc=27, cog=23), users-me.js:16 handleUsersMe (cyc=27, cog=35), account-models.js:238 loadModels (cyc=26, cog=16)","next_plan":"Pick models-helpers.js:137 normalizedConnections (cyc=21, lowest cog=9) as the first decomposition target - it's a pure helper, low branching, easy to split into named steps."}}
{"run":14,"commit":"18053d5","metric":92,"metrics":{"fallow_health_score":77.6,"dead_code":0,"dupes":14,"tests_pass":1,"lint_pass":1,"typecheck_pass":1,"dead_code_introduced":0,"duplication_introduced":6},"status":"keep","description":"First decomposition under new primary metric. Decomposed createConnectionDiscoveryCacheKey (cyc=21) in src/routers/models/models-helpers.js by extracting normalizeConnectionHeaders, normalizeConnectionManualModelsForCache, normalizeConnectionForCache helpers. complexity_introduced 93 → 92 (-1). fallow_health_score 77.60 unchanged (no regression), dead_code=0, dupes=14. Scoped tests 239/239, lint/typecheck pass. Confirms the metric responds to decomposition; -1 per file is realistic pace.","timestamp":1783792546619,"segment":4,"confidence":null,"asi":{"delta":"-1 (93 -> 92)","removed_finding":"createConnectionDiscoveryCacheKey cyc=21 in models-helpers.js:137","pace":"1 finding per file refactor; 93 findings remain","next_plan":"Pick next lowest-risk target: connections.js:253 getAllOpenAIConnectionConfigs (cyc=21, cog=9). Same pattern (helper file, low cognitive complexity, map+filter chain)."}}
{"run":15,"commit":"bb53b20","metric":90,"metrics":{"fallow_health_score":77.6,"dead_code":0,"dupes":14,"tests_pass":1,"lint_pass":1,"typecheck_pass":1,"dead_code_introduced":0,"duplication_introduced":6},"status":"keep","description":"Decomposed getAllOpenAIConnectionConfigs (was cyc=21, cog=9) in src/llm/connections.js. Extracted two helpers: normalizeUserGroupIds (was IIFE with 2 branches) and loadUserOpenAIConnectionsForEnv (wraps try/catch around loadUserOpenAIConnectionConfigs). After decomposition, getAllOpenAIConnectionConfigs no longer appears in complexity_introduced attribution (cyc dropped below 20 threshold). complexity_introduced 92 → 90 (-2 across this and prior model-helpers refactor). All gates green; fallow_health_score unchanged at 77.60. Scoped tests 761/761, lint/typecheck pass.","timestamp":1783793102398,"segment":4,"confidence":3,"asi":{"delta":"-2 (92 -> 90)","removed_findings":"getAllOpenAIConnectionConfigs cyc=21 (connections.js), createConnectionDiscoveryCacheKey cyc=21 (models-helpers.js)","pace":"~1 finding per file refactor when decomposition drops cyc below 20; 2 findings this iteration by fully extracting all helper calls","remaining_top_targets":"admin-connections-save.js:84 arrow (cyc=27 cog=23), users-me.js:16 handleUsersMe (cyc=27 cog=35), account-models.js:238 loadModels (cyc=26 cog=16), message-input-tool-selection.js:285 (cyc=24 cog=22), llm.js:21 streamLLM (cyc=23 cog=25), admin-connections-list.js:145 (cyc=22 cog=14)","next_plan":"Pick account-models.js:238 loadModels (cyc=26 cog=16) - lowest cog among top targets, pure loader function. Extract data fetch + normalization + transform steps."}}
{"run":16,"commit":"eb49950","metric":89,"metrics":{"fallow_health_score":77.6,"dead_code":0,"dupes":14,"tests_pass":1,"lint_pass":1,"typecheck_pass":1,"dead_code_introduced":0,"duplication_introduced":6},"status":"keep","description":"Decomposed loadModels (was cyc=26, cog=16) in public/js/features/account/account-models.js. Extracted four helpers: partitionModelsByVisibility, filterModelsByDisabled, buildMergedAttachmentCaps, applyLoadedModelsToState. loadModels no longer appears in complexity_introduced attribution. complexity_introduced 90 → 89 (-1). functions_over_60 dropped 50.2 → 50.1. All gates green; fallow_health_score unchanged at 77.60.","timestamp":1783793481584,"segment":4,"confidence":2.6666666666666665,"asi":{"delta":"-1 (90 -> 89)","removed_finding":"loadModels cyc=26 in account-models.js","side_effect":"functions_over_60_loc_per_k dropped 50.2 -> 50.1 (first movement in unit_size vital sign)","remaining_top_targets":"admin-connections-save.js:84 (cyc=27), users-me.js:16 handleUsersMe (cyc=27), message-input-tool-selection.js:285 (cyc=24), llm.js:21 streamLLM (cyc=23), admin-connections-list.js:145 (cyc=22)","next_plan":"users-me.js:16 handleUsersMe (cyc=27, cog=35) - router file with explicit branches; extract handler pieces."}}
{"run":5,"commit":"000dbf5","metric":88,"metrics":{"fallow_health_score":77.6,"dead_code":0,"dupes":14,"tests_pass":1,"lint_pass":1,"typecheck_pass":1,"dead_code_introduced":0,"duplication_introduced":6},"status":"keep","description":"Decomposed sanitize arrow (was cyc=27) in src/routers/admin/admin-connections-save.js. Extracted validateProviderType, resolveAndValidateUrl, resolveConnectionApiKey, defaultConnectionName, sanitizeConnectionInput helpers. complexity_introduced 89 -> 88.","timestamp":1783794282177,"segment":0,"confidence":2.5,"asi":{"hypothesis":"Extracted 5 small helpers from connection sanitization arrow; net -1 finding because helpers stay below CRAP threshold."}}
{"run":6,"commit":"63d4d81","metric":87,"metrics":{"fallow_health_score":77.6,"dead_code":0,"dupes":14,"tests_pass":1,"lint_pass":1,"typecheck_pass":1,"dead_code_introduced":0,"duplication_introduced":6},"status":"keep","description":"Decomposed handleUsersMe (was cyc=27) and nested handleSelfProfileUpdate (cyc=8, crap=72) in src/routers/users/users-me.js. Extracted requireActiveAccount, parseIncludeParam, loadUserProfileIncludeData, buildUserProfilePayload, handleUsersMeGet, parseSelfProfileBody, executeSelfProfileUpdate, handleSelfProfileUpdate as module-level helpers. complexity_introduced 88 -> 87.","timestamp":1783794810992,"segment":0,"confidence":3,"asi":{"hypothesis":"handleUsersMe had cyc=27; decomposing routes into module-level helpers (each below cyc=5) avoids CRAP failures since they have non-zero coverage via tests, or stay below the cyc^2 + cyc <= 30 threshold for 0%-cov helpers."}}
{"run":7,"commit":"123b940","metric":86,"metrics":{"fallow_health_score":77.6,"dead_code":0,"dupes":14,"tests_pass":1,"lint_pass":1,"typecheck_pass":1,"dead_code_introduced":0,"duplication_introduced":6},"status":"keep","description":"Decomposed updateToolControls (was cyc=24) in public/js/features/chat/message-input-tool-selection.js. Extracted computeAllEnabled, applyButtonMenuState, applyAllOnButtonState, applyAllOffButtonState, closeMenuIfEmpty, refreshOpenMenu helpers. complexity_introduced 87 -> 86.","timestamp":1783795080553,"segment":0,"confidence":3.5,"asi":{"hypothesis":"Extract 6 small DOM/state helpers from updateToolControls; new helpers below cyc=5 so they don't trigger CRAP threshold even at 0% coverage."}}
{"run":8,"commit":"fcfac93","metric":85,"metrics":{"fallow_health_score":77.6,"dead_code":0,"dupes":14,"tests_pass":1,"lint_pass":1,"typecheck_pass":1,"dead_code_introduced":0,"duplication_introduced":6},"status":"keep","description":"Decomposed streamLLM (was cyc=23) in src/llm.js. Extracted resolvePrimaryConnection, resolveConnectionByUnqualifiedModel, resolveConnectionByQualifiedModel, assertConnectionEnabled, buildStreamRequestHeaders, executeStreamRequest, assertStreamResponse helpers. complexity_introduced 86 -> 85.","timestamp":1783795478002,"segment":0,"confidence":4,"asi":{"hypothesis":"Decomposing the streaming pipeline into module-level helpers keeps each helper below cyc=5 (no CRAP risk)."}}
{"run":9,"commit":"cf34500","metric":84,"metrics":{"fallow_health_score":77.6,"dead_code":0,"dupes":14,"tests_pass":1,"lint_pass":1,"typecheck_pass":1,"dead_code_introduced":0,"duplication_introduced":6},"status":"keep","description":"Decomposed handleConnectionsTestPost (was cyc=22) in src/routers/admin/admin-connections-list.js. Extracted parseConnectionTestBody, respondToDiscoveryFailure, respondToDiscoverySuccess helpers. complexity_introduced 85 -> 84.","timestamp":1783795768162,"segment":0,"confidence":4.5,"asi":{"hypothesis":"Decomposing admin connection test handler into pure parse/format helpers below cyc=5 each."}}
{"run":10,"commit":"6fa031e","metric":83,"metrics":{"fallow_health_score":77.6,"dead_code":0,"dupes":14,"tests_pass":1,"lint_pass":1,"typecheck_pass":1,"dead_code_introduced":0,"duplication_introduced":6},"status":"keep","description":"Decomposed syncListState (was cyc=19) in public/js/features/account/account-integrations-events.js. Extracted applyRowFadedState, applyDisabledBadgeVisibility, applyAccessButtonVisibility, applyServerToggleState, applyToolsToggleRotation helpers. complexity_introduced 84 -> 83.","timestamp":1783796080459,"segment":0,"confidence":4,"asi":{"hypothesis":"DOM/state helpers extracted from syncListState stay below threshold because they're simple classlist toggles with low branching."}}
{"run":11,"commit":"373732b","metric":82,"metrics":{"fallow_health_score":77.6,"dead_code":0,"dupes":13,"tests_pass":1,"lint_pass":1,"typecheck_pass":1,"dead_code_introduced":0,"duplication_introduced":6},"status":"keep","description":"Decomposed <arrow> (was cyc=17, cog=19) in public/js/features/admin/settings/integrations.js. Extracted renderToolMarkup, renderToolToggle, toolToggleTitle, renderToolDescription helpers. complexity_introduced 83 -> 82; dupes also dropped 14 -> 13.","timestamp":1783796508096,"segment":0,"confidence":3.6666666666666665,"asi":{"hypothesis":"renderToolMarkup initially still had cyc=17; further splitting into renderToolToggle (cyc=2) + renderToolDescription (cyc=2) + toolToggleTitle (cyc=3) reduced parent below threshold."}}
{"run":12,"commit":"b673d89","metric":81,"metrics":{"fallow_health_score":77.6,"dead_code":0,"dupes":13,"tests_pass":1,"lint_pass":1,"typecheck_pass":1,"dead_code_introduced":0,"duplication_introduced":6},"status":"keep","description":"Decomposed contentToGoogleParts (was cyc=17, cog=25) in src/llm/provider-adapters-google.js. Extracted convertStringContentToGoogle, convertArrayContentToGoogleParts, appendTextPart, appendImageUrlPart, appendFilePart helpers. complexity_introduced 82 -> 81.","timestamp":1783796815481,"segment":0,"confidence":4,"asi":{"hypothesis":"Per-part append helpers (text/image_url/file) reduce cyc to 3 each; string-vs-array dispatch moved to thin wrappers."}}
{"run":13,"commit":"29e86e2","metric":74,"metrics":{"fallow_health_score":77.6,"dead_code":0,"dupes":13,"tests_pass":1,"lint_pass":1,"typecheck_pass":1,"dead_code_introduced":0,"duplication_introduced":6},"status":"keep","description":"Decomposed handleChatEvent (was cyc=17, crap=306) in public/js/features/chat/chat-realtime-controller.js. Extracted handleChatDeletedEvent, refreshActiveChatForEvent, shouldSkipRefresh, reloadActiveChatIfChanged helpers. complexity_introduced 81 -> 74 (big drop: nested arrows in handleChatEvent's body stopped counting as separate findings once the parent cyc dropped).","timestamp":1783797168237,"segment":0,"confidence":6.333333333333333,"asi":{"hypothesis":"Big win: handleChatEvent's large body had nested functions/arrows that were individually counted by fallow; extracting them surfaced them at lower cyc (some no longer exceed thresholds)."}}
{"run":14,"commit":"fa0d850","metric":73,"metrics":{"fallow_health_score":77.6,"dead_code":0,"dupes":13,"tests_pass":1,"lint_pass":1,"typecheck_pass":1,"dead_code_introduced":0,"duplication_introduced":6},"status":"keep","description":"Decomposed _extractTaggedSegments (was cyc=14, cog=35) in src/llm/stream-parser.js. Extracted _bufferLower, _findBestOpenToken, _consumeOutsideReasoning, _consumeInsideReasoning helpers. complexity_introduced 74 -> 73.","timestamp":1783798367295,"segment":0,"confidence":5.714285714285714,"asi":{"hypothesis":"Decompose stateful parsing loop into in-reasoning/out-of-reasoning branches; each helper has its own bounded state mutation."}}
{"run":15,"commit":"6ec49a8","metric":72,"metrics":{"fallow_health_score":77.6,"dead_code":0,"dupes":13,"tests_pass":1,"lint_pass":1,"typecheck_pass":1,"dead_code_introduced":0,"duplication_introduced":6},"status":"keep","description":"Decomposed <arrow> (was cyc=14, cog=16) in src/routers/users/users-admin-access.js. Extracted matchesRulePrincipal, buildDecoratedRule, resolveAccessState, rulePrincipalLabel helpers. complexity_introduced 73 -> 72.","timestamp":1783798768696,"segment":0,"confidence":5.25,"asi":{"hypothesis":"Extracting the principal matching and access-state resolution from the decorate arrow into pure helpers keeps each under cyc=5."}}
{"run":16,"commit":"3a57b34","metric":71,"metrics":{"fallow_health_score":77.6,"dead_code":0,"dupes":13,"tests_pass":1,"lint_pass":1,"typecheck_pass":1,"dead_code_introduced":0,"duplication_introduced":6},"status":"keep","description":"Decomposed syncProviderUi (was cyc=13) in public/js/features/account/account-connections-modal-ui-sync-provider.js. Extracted syncBaseUrlInput, clearMatchingBaseUrlValue, syncModalLabels, setLabelText, resolveUrlHint helpers. complexity_introduced 72 -> 71.","timestamp":1783799183110,"segment":0,"confidence":5.5,"asi":{"hypothesis":"Extracting base URL logic and label/hint setters from syncProviderUi keeps each helper under cyc=4."}}
{"run":17,"commit":"0245e37","metric":70,"metrics":{"fallow_health_score":77.6,"dead_code":0,"dupes":13,"tests_pass":1,"lint_pass":1,"typecheck_pass":1,"dead_code_introduced":0,"duplication_introduced":6},"status":"keep","description":"Decomposed setServerSelectionForCurrentChat (was cyc=13, cog=22) in public/js/features/chat/message-input-tool-selection.js. Extracted resolveNextSelection, resolveEnabledSelection, resolveDisableAllSelection, resolveDisableFromSelection, normalizeEmptySelection helpers. complexity_introduced 71 -> 70. very_high_risk dropped 5.0 -> 4.9.","timestamp":1783799509934,"segment":0,"confidence":4.6,"asi":{"hypothesis":"Selection-resolution branches into pure helpers; each helper under cyc=4."}}
{"run":18,"commit":"8fd36fd","metric":69,"metrics":{"fallow_health_score":77.6,"dead_code":0,"dupes":13,"tests_pass":1,"lint_pass":1,"typecheck_pass":1,"dead_code_introduced":0,"duplication_introduced":6},"status":"keep","description":"Decomposed loadMessages (was cyc=13, crap=182) in public/js/features/chat/chat-data-controller.js. Extracted setLoadingState, prepareMessagesForLoad, rememberResolvedLeaf, applyLoadedMessagesToState helpers. complexity_introduced 70 -> 69.","timestamp":1783799849085,"segment":0,"confidence":4,"asi":{"hypothesis":"Decomposing loadMessages into 4 small helpers reduces cyc from 13 to 5; still at CRAP threshold of 30 but no longer the cyc=13 finding."}}
{"run":19,"commit":"ce8039a","metric":67,"metrics":{"fallow_health_score":77.6,"dead_code":0,"dupes":13,"tests_pass":1,"lint_pass":1,"typecheck_pass":1,"dead_code_introduced":0,"duplication_introduced":6},"status":"keep","description":"Decomposed resolveModelIdForMode (was cyc=11, crap=132) in public/js/features/chat/chat-data-controller.js. Extracted pickDefaultModel, pickChatModel helpers. complexity_introduced 69 -> 67.","timestamp":1783800402749,"segment":0,"confidence":3.7142857142857144,"asi":{"hypothesis":"Decomposing fallback chain helpers drops cyc below CRAP threshold (cyc 11 -> each helper 4 with single || chain)."}}
{"run":20,"commit":"d37a08d","metric":66,"metrics":{"fallow_health_score":77.6,"dead_code":0,"dupes":13,"tests_pass":1,"lint_pass":1,"typecheck_pass":1,"dead_code_introduced":0,"duplication_introduced":6},"status":"keep","description":"Refactored matchesModelQuery (was cyc=12, crap=156) in src/routers/models/models-discovery.js. Replaced 4 separate optional-chain field accesses with a field array + .some loop. Extracted fieldMatchesQuery helper. complexity_introduced 67 -> 66.","timestamp":1783800839038,"segment":0,"confidence":3.375,"asi":{"hypothesis":"Using field array + .some eliminates 4 explicit ?. field accesses, dropping cyc from 12 to ~3."}}
{"run":21,"commit":"f6a829b","metric":65,"metrics":{"fallow_health_score":77.6,"dead_code":0,"dupes":13,"tests_pass":1,"lint_pass":1,"typecheck_pass":1,"dead_code_introduced":0,"duplication_introduced":6},"status":"keep","description":"Decomposed <arrow> (was cyc=11, crap=132) in src/chat/assistant-runner-stream-event.js. Replaced 5 inline if-branches with a handlers map. Extracted handleReasoningStart, handleReasoningDelta, handleReasoningEnd helpers. complexity_introduced 66 -> 65.","timestamp":1783801388778,"segment":0,"confidence":3.5,"asi":{"hypothesis":"Handler map + single dispatch lookup reduces the dispatcher's cyc from 7 to ~3."}}
{"run":22,"commit":"c14c79d","metric":64,"metrics":{"fallow_health_score":77.6,"dead_code":0,"dupes":13,"tests_pass":1,"lint_pass":1,"typecheck_pass":1,"dead_code_introduced":0,"duplication_introduced":6},"status":"keep","description":"Decomposed push (was cyc=11, cog=23) in src/llm/stream-parser.js. Extracted _processLine (per-line dispatch) and _ingestPayload (payload parsing) helpers. complexity_introduced 65 -> 64.","timestamp":1783802504137,"segment":0,"confidence":3.411764705882353,"asi":{"hypothesis":"Extracting per-line dispatch and payload ingestion helpers from a long while-loop reduces cognitive complexity by flattening nesting."}}
{"run":23,"commit":"570c95a","metric":63,"metrics":{"fallow_health_score":77.6,"dead_code":0,"dupes":13,"tests_pass":1,"lint_pass":1,"typecheck_pass":1,"dead_code_introduced":0,"duplication_introduced":6},"status":"keep","description":"Decomposed flush (was cyc=10, cog=25) in src/llm/stream-parser.js. Extracted _flushTrailingLine, _flushDataPayload, _flushTagBuffer helpers. complexity_introduced 64 -> 63.","timestamp":1783803450934,"segment":0,"confidence":3.3333333333333335,"asi":{"hypothesis":"Flattening nested if/else with three small named helpers (_flushTrailingLine, _flushDataPayload, _flushTagBuffer) keeps each helper below cognitive threshold."}}
{"run":24,"commit":"f9d9e0a","metric":62,"metrics":{"fallow_health_score":77.6,"dead_code":0,"dupes":13,"tests_pass":1,"lint_pass":1,"typecheck_pass":1,"dead_code_introduced":0,"duplication_introduced":6},"status":"keep","description":"Decomposed sanitizeObjectEntries (was cyc=10, cog=16) in src/utils/response.js. Extracted sanitizeObjectEntryInto for per-type dispatch. complexity_introduced 63 -> 62.","timestamp":1783804548128,"segment":0,"confidence":3.4444444444444446,"asi":{"hypothesis":"Extracting per-type dispatch from a typed loop into a named helper keeps the dispatcher below cognitive threshold."}}
{"run":25,"commit":"33a22e0","metric":60,"metrics":{"fallow_health_score":77.6,"dead_code":0,"dupes":13,"tests_pass":1,"lint_pass":1,"typecheck_pass":1,"dead_code_introduced":0,"duplication_introduced":6},"status":"keep","description":"Decomposed renderMembers arrow (was cyc=9, crap=90) in public/js/features/admin/users/groups-modal.js. Extracted 8 named helpers (renderMembersEmpty, renderMembersRows, renderMemberRow, renderMemberToggle, memberButtonClass, getMemberInitials, bindMemberToggleHandlers, renderMembersCount). complexity_introduced 62 -> 60 (-2).","timestamp":1783805568918,"segment":0,"confidence":3.3,"asi":{"hypothesis":"Extracting all branches of a render function into named helpers (each below CRAP threshold at 0% coverage since cyc^2+cyc <= 30) keeps the parent arrow under threshold."}}
{"run":26,"commit":"2dec390","metric":57,"metrics":{"fallow_health_score":77.6,"dead_code":0,"dupes":13,"tests_pass":1,"lint_pass":1,"typecheck_pass":1,"dead_code_introduced":0,"duplication_introduced":6},"status":"keep","description":"Decomposed buildEventKey (was cyc=8, crap=72) in public/js/features/chat/chat-realtime-controller.js. Replaced 6 inline String() calls with field array + .map loop. complexity_introduced 60 -> 57.","timestamp":1783806042788,"segment":0,"confidence":3.6,"asi":{"hypothesis":"Field array + .map with single ?. access per iteration drops cyc from 8 (with 6 ?. + 6 ||) to ~3."}}
{"run":27,"commit":"6f04588","metric":56,"metrics":{"fallow_health_score":77.6,"dead_code":0,"dupes":13,"tests_pass":1,"lint_pass":1,"typecheck_pass":1,"dead_code_introduced":0,"duplication_introduced":6},"status":"keep","description":"Decomposed formatDate (was cyc=8, crap=72) in public/js/shared/utils.js. Extracted parseDateOrNull and relativeOrAbsoluteDateLabel helpers. complexity_introduced 57 -> 56.","timestamp":1783806838293,"segment":0,"confidence":3.7,"asi":{"hypothesis":"Converting if/else-if chain to early-return if statements in a separate helper keeps cyc low while preserving behavior."}}
