{"run":58,"commit":"1f5a626","metric":22,"metrics":{"fallow_health_score":77.6,"dead_code":0,"dupes":13,"tests_pass":1,"lint_pass":1,"typecheck_pass":1,"dead_code_introduced":0,"duplication_introduced":6},"status":"discard","description":"Decomposed handleResetPasswordSubmit in public/js/bootstrap/auth-reset.js. Extracted submitResetPassword, gatherResetPasswordInputs, resolveResetToken helpers. Audit list count dropped 25 -> 23, but complexity_introduced metric remained 22. All gates green.","timestamp":1783923907482,"segment":0,"confidence":3.9444444444444446,"asi":{"hypothesis":"Extracting fetch/submission helpers from handleResetPasswordSubmit would lower its cyc below threshold and reduce complexity_introduced.","next_hint":"Target functions whose removal directly lowers the metric, e.g. cyc=6 functions like public/js/features/chat/chat-data-controller.js resolveFallbackMessageInsertion or public/js/features/chat/chat-shell-controller.js refreshChatListObserver, or higher cyc scripts/setup-wizard-steps.js functions.","rollback_reason":"complexity_introduced metric stayed at 22 despite removing two list findings; the removed functions were borderline CRAP=30 and not counted by the primary metric."}}
{"run":59,"commit":"1f5a626","metric":21,"metrics":{"fallow_health_score":77.6,"dead_code":0,"dupes":13,"tests_pass":1,"lint_pass":1,"typecheck_pass":1,"dead_code_introduced":0,"duplication_introduced":6},"status":"keep","description":"Decomposed readDirEntries (was cyc=6, crap=42) in scripts/audit-snapshots.js. Extracted isMissingDirectoryError and formatReadDirError helpers. complexity_introduced 22 -> 21 (-1). Tests, lint, typecheck pass.","timestamp":1783924186481,"segment":0,"confidence":4,"asi":{"hypothesis":"Extracting the ENOENT check and error formatting from readDirEntries lowers the parent's cyc below the CRAP threshold. Helper functions are tiny (cyc <=2).","next_hint":"Continue decomposing cyc=6 introduced functions, e.g. public/js/features/chat/chat-data-controller.js resolveFallbackMessageInsertion or public/js/features/chat/chat-shell-controller.js refreshChatListObserver."}}
{"run":60,"commit":"4bd5caa","metric":20,"metrics":{"fallow_health_score":77.6,"dead_code":0,"dupes":13,"tests_pass":1,"lint_pass":1,"typecheck_pass":1,"dead_code_introduced":0,"duplication_introduced":6},"status":"keep","description":"Decomposed resolveFallbackMessageInsertion (was cyc=6, crap=42) in public/js/features/chat/chat-data-controller.js. Extracted extractFallbackContext helper. complexity_introduced 21 -> 20 (-1). Tests, lint, typecheck pass.","timestamp":1783924473050,"segment":0,"confidence":3.945945945945946,"asi":{"hypothesis":"Moving the optional-chain id check and parent_id ternary into extractFallbackContext reduces the parent's cyclomatic complexity below the CRAP threshold.","next_hint":"Continue with cyc=6 refreshChatListObserver or cyc=7 setup-wizard functions."}}
{"run":61,"commit":"0fe64e8","metric":19,"metrics":{"fallow_health_score":77.6,"dead_code":0,"dupes":13,"tests_pass":1,"lint_pass":1,"typecheck_pass":1,"dead_code_introduced":0,"duplication_introduced":6},"status":"keep","description":"Decomposed refreshChatListObserver (was cyc=6, crap=42) in public/js/features/chat/chat-shell-controller.js. Extracted handleIntersectionEntries helper. complexity_introduced 20 -> 19 (-1). Tests, lint, typecheck pass.","timestamp":1783924800421,"segment":0,"confidence":3.8947368421052633,"asi":{"hypothesis":"Extracting the IntersectionObserver callback arrow removes its nested if branch from the parent's cyclomatic complexity count.","next_hint":"Target remaining cyc=5/6/7 introduced functions; scripts/setup-wizard-steps.js functions are high-cyc and likely not covered by tests."}}
{"run":62,"commit":"fff400f","metric":19,"metrics":{"fallow_health_score":77.6,"dead_code":0,"dupes":13,"tests_pass":1,"lint_pass":1,"typecheck_pass":1,"dead_code_introduced":0,"duplication_introduced":6},"status":"discard","description":"Decomposed stepCreateKvNamespaces (was cyc=7) in scripts/setup-wizard-steps.js. Extracted createKvNamespace helper. complexity_introduced metric remained 19. All gates green.","timestamp":1783925124604,"segment":0,"confidence":3.8947368421052633,"asi":{"hypothesis":"Extracting per-namespace creation logic would drop stepCreateKvNamespaces below CRAP threshold.","next_hint":"Focus on functions that the metric actually counts; the cyc=7 setup-wizard functions may not be counted. Target cyc=11 admin/users overview arrow or cyc=15 runStep, which are definitely above threshold.","rollback_reason":"complexity_introduced did not decrease; the decomposed function was not among the counted metric findings."}}
{"run":63,"commit":"fff400f","metric":17,"metrics":{"fallow_health_score":77.6,"dead_code":0,"dupes":13,"tests_pass":1,"lint_pass":1,"typecheck_pass":1,"dead_code_introduced":0,"duplication_introduced":6},"status":"keep","description":"Decomposed loadLogs (was cyc=5, crap=30) in public/js/features/admin/audit-logs.js. Extracted appendAuditLogFilters and parseAuditLogsError helpers. complexity_introduced 19 -> 17 (-2). Tests, lint, typecheck pass.","timestamp":1783925401504,"segment":0,"confidence":4,"asi":{"hypothesis":"Extracting filter appending and error parsing from loadLogs drops the parent's cyc from 5 to 3, removing the CRAP finding.","next_hint":"Decompose the other audit-logs function render (cyc=5) and remaining cyc=5 functions."}}
{"run":64,"commit":"7bef5d1","metric":16,"metrics":{"fallow_health_score":77.6,"dead_code":0,"dupes":13,"tests_pass":1,"lint_pass":1,"typecheck_pass":1,"dead_code_introduced":0,"duplication_introduced":6},"status":"keep","description":"Decomposed handleArrowDown (was cyc=5, crap=30) in public/js/features/chat/model-selector-controller.js. Extracted expandVisibleListAndAdvance helper. complexity_introduced 17 -> 16 (-1). Tests, lint, typecheck pass.","timestamp":1783925706393,"segment":0,"confidence":4.052631578947368,"asi":{"hypothesis":"Extracting the list-expansion branch from the if/else-if chain drops handleArrowDown's cyclomatic complexity below the CRAP threshold.","next_hint":"Continue decomposing remaining cyc=5 functions; handleArrowUp in same file may also be decomposable."}}
{"run":65,"commit":"d196e82","metric":14,"metrics":{"fallow_health_score":77.6,"dead_code":0,"dupes":13,"tests_pass":1,"lint_pass":1,"typecheck_pass":1,"dead_code_introduced":0,"duplication_introduced":6},"status":"keep","description":"Decomposed stepCreateKvNamespaces (was cyc=7, crap=56) in scripts/setup-wizard-steps.js. Extracted createSingleKvNamespace and maybeUpdateWranglerKvIds helpers. complexity_introduced 16 -> 14 (-2). Lint/typecheck pass.","timestamp":1783926459434,"segment":0,"confidence":4.157894736842105,"asi":{"hypothesis":"Extracting per-namespace creation and the auto-update branch into named helpers drops the parent's cyc below the CRAP threshold.","next_hint":"Decompose updateWranglerAllowedOrigins and promptJwtSecret next."}}
{"run":66,"commit":"1bb9d40","metric":13,"metrics":{"fallow_health_score":77.6,"dead_code":0,"dupes":13,"tests_pass":1,"lint_pass":1,"typecheck_pass":1,"dead_code_introduced":0,"duplication_introduced":6},"status":"keep","description":"Decomposed updateWranglerAllowedOrigins (was cyc=7, crap=56) in scripts/setup-wizard-steps.js. Extracted isPlaceholderOrigin, applyOriginToWrangler, and parseOriginInput helpers. complexity_introduced 14 -> 13 (-1). Lint/typecheck pass.","timestamp":1783927159528,"segment":0,"confidence":4.102564102564102,"asi":{"hypothesis":"Extracting validation and file-write logic into named helpers drops the parent's cyclomatic complexity below the CRAP threshold.","next_hint":"Decompose promptJwtSecret next."}}
{"run":67,"commit":"658cd1a","metric":12,"metrics":{"fallow_health_score":77.6,"dead_code":0,"dupes":13,"tests_pass":1,"lint_pass":1,"typecheck_pass":1,"dead_code_introduced":0,"duplication_introduced":6},"status":"keep","description":"Decomposed promptJwtSecret (was cyc=7, crap=56) in scripts/setup-wizard-steps.js. Extracted setJwtSecretFromInput and promptAndSetGeneratedJwtSecret helpers. complexity_introduced 13 -> 12 (-1). Lint/typecheck pass.","timestamp":1783927745195,"segment":0,"confidence":4.2631578947368425,"asi":{"hypothesis":"Extracting the env-var branch and generated-secret branch into named helpers drops the parent's cyclomatic complexity below the CRAP threshold.","next_hint":"Tackle the remaining cyc=5 functions in the introduced list, or run another workflow to pick best targets."}}
{"run":68,"commit":"658cd1a","metric":11,"metrics":{"fallow_health_score":77.6,"dead_code":0,"dupes":13,"tests_pass":1,"lint_pass":1,"typecheck_pass":1,"dead_code_introduced":0,"duplication_introduced":6},"status":"keep","description":"Decomposed stepCreateD1Database (was cyc=5, crap=30) in scripts/setup-wizard-steps.js. Extracted promptAndUpdateD1Id and maybeUpdateWranglerD1Id helpers. complexity_introduced 12 -> 11 (-1). Lint/typecheck pass.","timestamp":1783927973058,"segment":0,"confidence":4.1,"asi":{"hypothesis":"Extracting inline prompt-update and confirm-update branches into named helpers reduces the parent's cyc below threshold.","next_hint":"Continue with the remaining cyc=5 functions in the introduced list."}}
{"run":69,"commit":"f25f0c4","metric":10,"metrics":{"fallow_health_score":77.6,"dead_code":0,"dupes":13,"tests_pass":1,"lint_pass":1,"typecheck_pass":1,"dead_code_introduced":0,"duplication_introduced":6},"status":"keep","description":"Decomposed prompt (was cyc=5, crap=30) in scripts/setup-wizard-utils.js. Extracted buildPromptSuffix and normalizePromptAnswer helpers. complexity_introduced 11 -> 10 (-1). Tests, lint, typecheck pass.","timestamp":1783928285658,"segment":0,"confidence":4.15,"asi":{"hypothesis":"Extracting suffix formatting and answer normalization from prompt drops the parent's cyclomatic complexity below the CRAP threshold.","next_hint":"Continue decomposing remaining cyc=5 functions."}}
{"run":70,"commit":"43e508a","metric":9,"metrics":{"fallow_health_score":77.6,"dead_code":0,"dupes":13,"tests_pass":1,"lint_pass":1,"typecheck_pass":1,"dead_code_introduced":0,"duplication_introduced":6},"status":"keep","description":"Decomposed handleResendVerification (was cyc=5, crap=30) in src/routers/auth/auth-resend-verification.js. Extracted parseResendBody helper. complexity_introduced 10 -> 9 (-1). Tests, lint, typecheck pass (measure command timed out but emitted metrics).","timestamp":1783928787521,"segment":0,"confidence":4.097560975609756,"asi":{"hypothesis":"Extracting JSON body parsing from the router handler reduces the parent's cyclomatic complexity below the CRAP threshold.","next_hint":"Continue with remaining cyc=5 functions.","note":"run_experiment timed out at 300s but metrics were emitted; lint/typecheck re-verified manually."}}
{"run":71,"commit":"43e508a","metric":8,"metrics":{"fallow_health_score":77.6,"dead_code":0,"dupes":13,"tests_pass":1,"lint_pass":1,"typecheck_pass":1,"dead_code_introduced":0,"duplication_introduced":6},"status":"keep","description":"Decomposed handlePrefetchError (was cyc=5, crap=30) in public/js/bootstrap/session-bootstrap.js. Extracted applyCachedModelsIfAvailable helper. complexity_introduced 9 -> 8 (-1). Tests, lint, typecheck pass.","timestamp":1783929077342,"segment":0,"confidence":4.0476190476190474,"asi":{"hypothesis":"Extracting cached-models application into a named helper drops the parent's cyclomatic complexity below the CRAP threshold.","next_hint":"Continue with remaining cyc=5 functions."}}
{"run":72,"commit":"43e508a","metric":7,"metrics":{"fallow_health_score":77.6,"dead_code":0,"dupes":13,"tests_pass":1,"lint_pass":1,"typecheck_pass":1,"dead_code_introduced":0,"duplication_introduced":6},"status":"keep","description":"Decomposed handleError (was cyc=5, crap=30) in public/js/shared/utils/sse-event-handler.js. Extracted resolveErrorMessage and buildErrorAssistantText helpers. complexity_introduced 8 -> 7 (-1). Tests, lint, typecheck pass.","timestamp":1783929361983,"segment":0,"confidence":4.095238095238095,"asi":{"hypothesis":"Extracting error-message resolution and assistant-text formatting into named helpers drops the parent's cyclomatic complexity below the CRAP threshold.","next_hint":"Continue with remaining cyc=5 functions."}}
{"run":73,"commit":"43e508a","metric":5,"metrics":{"fallow_health_score":77.6,"dead_code":0,"dupes":13,"tests_pass":1,"lint_pass":1,"typecheck_pass":1,"dead_code_introduced":0,"duplication_introduced":6},"status":"keep","description":"Decomposed getMessageById (was cyc=5, crap=30) in public/js/features/chat/chat-wire-controllers.js. Extracted resolveMessageList and findMessageInList helpers. complexity_introduced 7 -> 5 (-2). Tests, lint, typecheck pass.","timestamp":1783929640087,"segment":0,"confidence":4,"asi":{"hypothesis":"Extracting list resolution and message lookup into tiny helpers drops the parent's cyclomatic complexity below the CRAP threshold.","next_hint":"Continue with remaining cyc=5 functions; buildTempChatImpl next."}}
{"run":74,"commit":"43e508a","metric":4,"metrics":{"fallow_health_score":77.6,"dead_code":0,"dupes":13,"tests_pass":1,"lint_pass":1,"typecheck_pass":1,"dead_code_introduced":0,"duplication_introduced":6},"status":"keep","description":"Decomposed renderUsersOverviewOrGroups (was cyc=5, crap=30) in public/js/features/admin/admin-controller-subcontent.js. Extracted resolveOverviewRenderer helper. complexity_introduced 5 -> 4 (-1). Tests, lint, typecheck pass.","timestamp":1783929915100,"segment":0,"confidence":4.1395348837209305,"asi":{"hypothesis":"Extracting renderer dispatch into a function-returning helper drops the parent's cyclomatic complexity below the CRAP threshold.","next_hint":"Continue with remaining cyc=5/5+ functions; connections-access-modal onExecute next."}}
{"run":75,"commit":"43e508a","metric":3,"metrics":{"fallow_health_score":77.6,"dead_code":0,"dupes":12,"tests_pass":1,"lint_pass":1,"typecheck_pass":1,"dead_code_introduced":0,"duplication_introduced":5},"status":"keep","description":"Decomposed connections-access-modal onExecute arrow (was cyc=5, crap=30). Extracted buildConnectionAccessSavePayload helper. complexity_introduced 4 -> 3 (-1); dupes 13 -> 12. Tests, lint, typecheck pass.","timestamp":1783930283577,"segment":0,"confidence":4.090909090909091,"asi":{"hypothesis":"Extracting the payload construction (filter/map + ternary) from the onExecute arrow drops its cyclomatic complexity below threshold and removes a duplication instance.","next_hint":"Continue with remaining cyc=5 functions; models-event-handlers arrow and admin overview arrows."}}
{"run":76,"commit":"43e508a","metric":2,"metrics":{"fallow_health_score":77.6,"dead_code":0,"dupes":12,"tests_pass":1,"lint_pass":1,"typecheck_pass":1,"dead_code_introduced":0,"duplication_introduced":5},"status":"keep","description":"Decomposed overview.js arrows: extracted computeTotalPages and applyAddUserTabClasses helpers. Removed cyc=5 nextButton arrow and reduced setTab from cyc=11. complexity_introduced 3 -> 2 (-1). Tests, lint, typecheck pass.","timestamp":1783930667049,"segment":0,"confidence":4.136363636363637,"asi":{"hypothesis":"Extracting total-page computation and tab-class application into helpers drops the nextButton arrow below threshold and reduces setTab complexity.","next_hint":"Tackle models-event-handlers arrow and then runStep."}}
{"run":77,"commit":"43e508a","metric":1,"metrics":{"fallow_health_score":77.6,"dead_code":0,"dupes":12,"tests_pass":1,"lint_pass":1,"typecheck_pass":1,"dead_code_introduced":0,"duplication_introduced":5},"status":"keep","description":"Decomposed models-event-handlers bindDelegatedEvents arrow (was cyc=5). Extracted named input/change/click handlers and a resolveModelClickAction dispatcher. complexity_introduced 2 -> 1 (-1). Tests, lint, typecheck pass.","timestamp":1783931025021,"segment":0,"confidence":4.181818181818182,"asi":{"hypothesis":"Replacing inline event-listener arrows with named handlers and a click-action dispatcher drops the parent arrow below the CRAP threshold.","next_hint":"Final target: src/chat/assistant-runner.js runStep (cyc=15). Decompose carefully."}}
{"run":78,"commit":"43e508a","metric":0,"metrics":{"fallow_health_score":77.6,"dead_code":0,"dupes":12,"tests_pass":1,"lint_pass":1,"typecheck_pass":1,"dead_code_introduced":0,"duplication_introduced":5},"status":"keep","description":"Decomposed runStep (was cyc=15) in src/chat/assistant-runner.js. Extracted startLlmStream, buildStreamParser, processStreamDelta, processStreamIteration, flushFinalDelta, checkCancelledAndClose, buildToolLoopResult, buildFollowUpResult, buildFinalResult, resolveStepOutcome helpers. complexity_introduced 1 -> 0. Audit verdict changed from fail to warn. Tests, lint, typecheck pass.","timestamp":1783931385149,"segment":0,"confidence":4.181818181818182,"asi":{"hypothesis":"Decomposing the monolithic runStep into focused helpers for stream start, iteration, finalization, cancellation, and outcome resolution drops all introduced complexity findings below thresholds.","next_hint":"Primary metric reached 0. The remaining audit verdict is warn due to duplication_introduced=5 (pre-existing). Consider whether to continue reducing dupes or declare the complexity goal achieved."}}
{"run":79,"commit":"2a35002","metric":0,"metrics":{"fallow_health_score":77.6,"dead_code":0,"dupes":10,"tests_pass":1,"lint_pass":1,"typecheck_pass":1,"dead_code_introduced":0,"duplication_introduced":3},"status":"keep","description":"Deduplicate tool base-field mapping across src/shared/tool-servers-shared.js, src/admin/tool-servers-utils.js, and src/routers/chat.js. Extracted pickToolBaseFields helper. duplication_introduced 5 -> 3, dupes_total 12 -> 10. complexity_introduced remains 0. Tests, lint, typecheck pass.","timestamp":1783931957021,"segment":0,"confidence":4.181818181818182,"asi":{"hypothesis":"Sharing the name/title/description tool-field extraction eliminates two introduced duplication clone groups at once.","next_hint":"duplication_introduced=3 remains. Continue with the next easiest introduced clone group (parseJsonObject or withTimeout) to push toward audit verdict pass."}}
{"run":80,"commit":"2a35002","metric":0,"metrics":{"fallow_health_score":77.6,"dead_code":0,"dupes":9,"tests_pass":1,"lint_pass":1,"typecheck_pass":1,"dead_code_introduced":0,"duplication_introduced":2},"status":"keep","description":"Extract shared withTimeout helper into src/utils/promise.js and reuse in files-health-handler.js and services/uploads.js. duplication_introduced 3 -> 2, dupes_total 10 -> 9. complexity_introduced remains 0. Tests, lint, typecheck pass.","timestamp":1783932282803,"segment":0,"confidence":4.181818181818182,"asi":{"hypothesis":"Moving the identical timeout-race pattern into a shared util removes one introduced duplication group.","next_hint":"duplication_introduced=2 remains. Next target is either parseJsonObject (tool-servers-user.js / users-helpers.js) or the default callback destructuring in chat-message-stream.js / chat-render-controller.js."}}
{"run":81,"commit":"2a35002","metric":0,"metrics":{"fallow_health_score":77.6,"dead_code":0,"dupes":8,"tests_pass":1,"lint_pass":1,"typecheck_pass":1,"dead_code_introduced":0,"duplication_introduced":1},"status":"keep","description":"Extract shared parseJsonObject helper into src/utils/json.js and reuse in src/admin/tool-servers-user.js and src/routers/users/users-helpers.js. Re-export from users-helpers.js for backward compatibility with tests. duplication_introduced 2 -> 1, dupes_total 9 -> 8. complexity_introduced remains 0. Tests, lint, typecheck pass.","timestamp":1783932847828,"segment":0,"confidence":4.181818181818182,"asi":{"hypothesis":"Centralizing parseJsonObject in a shared util removes its duplicate definition while preserving the public export surface for tests.","next_hint":"duplication_introduced=1 remains. Last introduced group is the default callback destructuring in chat-message-stream.js / chat-render-controller.js."}}
{"run":82,"commit":"2a35002","metric":0,"metrics":{"fallow_health_score":77.6,"dead_code":0,"dupes":8,"tests_pass":1,"lint_pass":1,"typecheck_pass":1,"dead_code_introduced":0,"duplication_introduced":0},"status":"keep","description":"Extract shared STREAM_CALLBACK_DEFAULTS into public/js/features/chat/chat-stream-callbacks.js and reuse in chat-message-stream.js and chat-render-controller.js. duplication_introduced 1 -> 0. Audit verdict changed from warn to pass. complexity_introduced remains 0. Tests, lint, typecheck pass.","timestamp":1783933183084,"segment":0,"confidence":4.181818181818182,"asi":{"hypothesis":"Centralizing the repeated stream callback defaults in a shared constants object removes the final introduced duplication group.","next_hint":"Primary and introduced duplication goals achieved. Audit verdict is pass. Health score still 77.6 due to formula penalties. No further actionable audit blockers remain."}}
{"run":83,"commit":"6ad256b","metric":0,"metrics":{"fallow_health_score":77.6,"dead_code":0,"dupes":7,"tests_pass":1,"lint_pass":1,"typecheck_pass":1,"dead_code_introduced":0,"duplication_introduced":0},"status":"keep","description":"Extract bufferToHex helper in src/utils/encoding.js and reuse in auth-password-reset.js. dupes_total 8 -> 7. complexity_introduced remains 0, audit verdict pass. Tests, lint, typecheck pass.","timestamp":1783934002528,"segment":0,"confidence":4.181818181818182,"asi":{"hypothesis":"Extracting the repeated byte-array-to-hex conversion removes one clone group without affecting audit introduced metrics.","next_hint":"dupes_total=7 remains. The remaining clones are pre-existing/inherited. Continue only if the user wants further quality cleanup; the original audit goals are already met."}}
